Deviation ID,Caption
1B68992F-C840-B46B-A982-C71AF521C5FA,"a drawing of a girl with stars on her face and a flower crown on her head, with a message written in the middle, Alice Prin, stars, a manga drawing, space art"
671FAF8C-D2E9-3165-3376-E3736BD1F9C5,"a painting of a tree with a boat in the water and a boat in the water with a tree on it, Cyril Rolando, magical atmosphere, a detailed matte painting, fantasy art"
6FD66CEE-AFB8-A294-6CB4-11848BCA5377,"a horse with a saddle standing on a hill with a person in the background and a sky with clouds, Brom, hearthstone, a detailed painting, fantasy art"
46FE4F99-5800-E659-DC5A-42004B32C686,"a bird sitting on a branch with berries on it's branch and snow falling on it's head, Abidin Dino, trending on art station, a digital painting, plein air"
B7F4A03D-F956-3A2B-0EF7-CA13EF937815,"a pair of headphones with glowing eyes and ears on a table with a dark background and a caption that says, alien wear, Aya Goda, cyberpunk style, a 3D render, panfuturism"
73CE5BCA-0021-8F6E-7AB3-31B9D5B4F3EC,"a group of cartoon characters sitting on the ground in the grass with a dragon and a dog in front of them, disney, pokemon, a storybook illustration, furry art"
EE8C663C-9A70-FD52-B736-DAE533190B7A,"a drawing of a cat with a rainbow background and sound waves in the background, with a pink cat on the left side of the image, Brom, chromatic aberration, a pastel, holography"
B7A17D0E-288B-789D-474D-0F73B02AD546,"a painting of a volcano with a person standing on it's side in the foreground and a dark sky in the background, Cyril Rolando, colorful clouds, an abstract painting, fantasy art"
693F36BF-2D9B-42FB-F65D-EDF95467AE89,"a snowflake is shown in the middle of the picture, with a blurry background of snow flakes, An Gyeon, snow, a microscopic photo, aestheticism"
289C2BC5-CBF9-059F-55D4-CF2C444D1567,"a painting of a wolf and a little girl in a forest with a fairy tale in the background,, Brom, storybook illustration, a storybook illustration, fantasy art"
39412661-94EF-F9AA-7A77-47AF578D4182,"a poster with a woman's nose and nose shapes in different stages of development, including the nose and nose, Charlie Bowater, realistic face, an illustration of, process art"
9B57C00B-8020-0230-7B31-3C5C93B15D3C,"a painting of a deer in a field with a person standing in front of it and a full moon in the background, Anato Finnstark, trending on art station, a matte painting, fantasy art"
F1EB58FF-F4AD-D083-A3D0-8A663DAEF872,"a girl and a dog sitting in a chair in front of a fireplace with a book in their hands, artist, cozy, a storybook illustration, temporary art"
F26ACCC2-CCE3-419C-FEBF-8A6411BA9F99,"a drawing of a cat looking out a window with stars on the outside of it and a star on the inside of the window, An Gyeon, storybook illustration, a storybook illustration, pop surrealism"
E6213C0F-BB2F-11EF-D6B9-0AEAFF190603,"a path in the middle of a forest with tall trees on both sides of it and a path leading to the end, David Martin, forest, a matte painting, naturalism"
755799C0-4797-EF4B-98B7-499DFE0E82A8,"a woman with a gas mask and flowers on her face holding a bottle of water and a cigarette in her hand, Cyril Rolando, dystopian art, cyberpunk art, environmental art"
14E2736D-A7E7-E1DB-BEB3-DF1B36E36AEC,"a painting of a woman with a necklace and a ring around her neck and a triangle around her neck, Charlie Bowater, artem demura, a character portrait, space art"
09426B03-8EFF-ACB9-7C29-44600C7562A0,"a group of circular shapes with the words arcane circles in the middle of them and a clock in the middle, Cedric Seaut (Keos Masons), adobe photoshop, a detailed matte painting, computer art"
90E570D6-6077-0C92-7B53-4A21A51883D1,"a bird with a piece of bread in its beak and a hat on its head, standing on a pile of rocks, Chris LaBrooy, upper body, a digital painting, pop surrealism"
9F765E3B-FEAC-0799-4624-F7FB1E1D7466,"a white cat with a red scarf around its neck and eyes, sitting down with a branch in its mouth, Brian Snøddy, trending on art station, a digital painting, furry art"
E2359910-2987-6553-D594-39F5955B9ADB,"a white wing with a black sign in front of it that says wing tutorial on it's side, Charlie Bowater, trending on art station, a digital painting, photorealism"
84946F5A-830B-C47C-F238-04728C8EAC19,"a drawing of a woman with a hat on her head and a veil on her head, with a bow in her hair, Charlie Bowater, anime art, a character portrait, gothic art"
FE309B83-A560-9EFD-04C2-D17F9D86AC18,"a blue sky with clouds and a white banner that says photoshop & gimp brushes clouds & mist, David Imms, adobe photoshop, a detailed matte painting, photorealism"
0A82A486-A317-3EB3-208B-F04492295533,"a pink object with two holes in it on a table with a gray background and a black and white photo, Bernd Fasching, pink, a raytraced image, pop art"
78178130-E206-C635-E04D-649492995270,"a green dragon sitting on top of a mountain next to a forest and a lake with a bird flying over it, Clint Cearley, dragon art, a detailed painting, fantasy art"
ABDAE6A5-1AED-346E-7A85-078145196CFA,"a drawing of a person with different facial expressions and hair styles, with the caption patron on the bottom, Ahmed Yacoubi, character design, concept art, process art"
FBAC04F0-2345-6A51-CFB9-603A1BAD99BE,"a painting of two dragon fighting each other in a field of grass and dirt, with a yellow sky in the background, Anne Stokes, dragon art, a detailed painting, fantasy art"
CAE7F1DC-5DA5-19ED-5DD1-D2A4491CB5E8,"a painting of a forest with a boat in the water and trees in the background with a boat in the distance, Anato Finnstark, matte fantasy painting, a detailed matte painting, fantasy art"
F59C595E-A7B0-746F-7858-A613968EE751,"a woman with a flower crown on her head and a butterfly on her shoulder, with her hand on her face, Charlie Bowater, flowing hair, a character portrait, gothic art"
ECD84E30-BC14-8EC3-2E43-24904140472E,"a painting of a tree with a yellow light coming out of it's trunk and a blue sky with stars, Cyril Rolando, storybook illustration, a storybook illustration, fantasy art"
0C195A71-DF04-2AA4-E60E-3A7FC6BA5A24,"a painting of a man sitting on a dock watching a whale swim by in the ocean with a cloudy sky, Cyril Rolando, dreamlike, a painting, magic realism"
F5AE0E64-07A1-55AF-58A2-9C06F2E93E2B,"a drawing of a girl with a pencil in her mouth and a notebook in her hand with a drawing of a girl with a dragon on it, Anna Dittmann, trending on art station, a character portrait, pop surrealism"
7D06CDBD-546B-247E-5392-A092D0B673C0,"a dragon is flying over a city by the water with a fountain in front of it and a city in the background, Clint Cearley, league of legends concept art, concept art, fantasy art"
BA598A5F-C9E9-7865-3CC0-2DC0634B562F,"a drawing of a woman with flowers in her hair and a pink background with a pink background and a pink background, Artgerm, anime art style, a manga drawing, aestheticism"
30E5BF06-9CBD-D428-7D37-002B9A073268,"a woman with a black dress and a black background with clouds and a dark sky with a dark cloud, Daniel Lieske, fashion photography, an airbrush painting, gothic art"
9DD467F4-78E3-8C9C-C4C9-4A08C8E3934D,"a painting of a wolf with a lot of people around it and a giant sign above it that says tokyo, Cyril Rolando, trending on art station, concept art, furry art"
6E2660BF-B6E1-DD81-828B-F3DEBA9E80A8,"a girl with a cat ears and headphones on her head is looking at the camera with a smile, Artgerm, anime art, a character portrait, computer art"
C72D6A0A-5BF5-1574-35F7-2AF72FF34C3B,"a dragon with large wings is in the woods with trees and branches in the background, with a man standing on the ground, Eddie Mendoza, weta digital, concept art, fantasy art"
46B108A9-A356-1556-155A-B5F769CE20B9,"a cat sitting on top of a body of water next to a gold fish in the sky with a city in the background, Cyril Rolando, fantasy magic, a storybook illustration, pop surrealism"
BCB39FC4-B649-5CCB-5DF4-250125F3A0B9,"a close up of a necklace on a mannequin's neck with a chain around it and a bird on it, Dirk Crabeth, fantasy style, an abstract sculpture, gothic art"
2441E955-9BF5-F2B0-8DEB-A5F49AE68EF2,"a black cat with green eyes stares at bubbles of water on a window sill in the background,, Charlie Bowater, highly detailed digital painting, a digital painting, gothic art"
AF4893BE-B555-FD2A-049C-003ED7799D76,"a cartoon girl with a donut and a donut sign in front of her, with a donut in the foreground, Alice Prin, hints of yayoi kasuma, a detailed drawing, pop surrealism"
D04DDABA-9035-2566-C8F9-FCB7C10F6701,"a painting of a fish in the water with red and blue colors on it's body and a black background, Dirk Crabeth, abstract brush strokes, an abstract painting, metaphysical painting"
367B0BD5-85FE-0E46-68D9-6C2F9F62B0FC,"a woman with a sword and a demon on her shoulder, holding a sception in her hand, Anne Stokes, epic fantasy character art, a character portrait, gothic art"
F8858251-EC33-D790-04C5-84FB7129B86D,"a anime character with a very short hair and a very sexy body, with a star in the background, Cedric Seaut (Keos Masons), symmetry!!, a character portrait, vanitas"
759CFF0C-AFBC-A616-BDEE-C59492F4AE8C,"a blue background with water and bubbles in it with the words photoshop and gimp brushes water written below, An Gyeon, highly detailed digital painting, a detailed matte painting, photorealism"
A5005988-D5B8-293E-3FE6-9CA12C028E5C,"a computer screen with a plant and a window with a picture of a tree in it and a plant in the middle, Atey Ghailan, trending on art station, a detailed matte painting, context art"
1FF3812B-04C1-0E95-753C-EA934BBB919D,"a man with a sword and a green cape on his head and a green cape on his head, holding a sword, Armin Hansen, official art, concept art, visual art"
F9C13FCE-A86A-F717-E871-3FD2C79ADF12,"a cartoon of a rabbit giving a flower to a woman on a bench with a sign saying, reason, why are you origins?, artist, flowers, a detailed drawing, context art"
373068A9-2218-B5C2-69EA-82D9A83361AC,"a drawing of a blonde haired woman with a black top and a green shirt on, with her arms crossed, Cedric Seaut (Keos Masons), action pose, a character portrait, shock art"
412479D6-A20F-3425-3EFF-8E2B4325565C,"a white dog is playing with a red tail in the grass with trees in the background and a blue sky, Brom, flowing hair, a fine art painting, furry art"
DA532150-34A5-9EA0-775D-E599E7DAB9DD,"a man on a horse with a huge dragon on his back and a wolf on his back, in the snow, Chris Rahn, magic the gathering artwork, a detailed painting, fantasy art"
6D277074-56FE-6E66-9CAC-5036DC1196AE,"a painting of a bird flying through the sky with clouds in the background and a bird flying in the sky, Alejandro Burdisio, fantasy artwork, an ultrafine detailed painting, fantasy art"
C83290D0-375E-49FF-90B3-4DAA8189F3B9,"two anime characters with cat ears and green eyes, one with a cat ears and one with a cat tail, Alice Prin, anime art style, concept art, context art"
96AD06CD-380F-1ABC-728A-3C1F250539AD,"a series of images of the sky with different colors and shapes in it, including the stars and clouds, Eden Box, matte painting, a detailed matte painting, light and space"
D43E3957-25E1-56D0-1714-05927AB0306B,"a green dragon with wings and a man standing next to it with other small dinosaurs in front of it, Cedric Seaut (Keos Masons), dragon art, concept art, fantasy art"
B23573B6-EF91-5082-DF03-7696EE01AFAA,"a person holding a pen and drawing a picture of a girl with blue hair and blue eyes and a blue shirt, Cedric Seaut (Keos Masons), underwater, a manga drawing, pointillism"
4C635F23-E23D-D8EA-0E7D-5E44E3110B36,"two girls are laying down in a frozen cave with snowflakes on them and one girl is holding a frozen heart, Andor Basch, cosplay, a storybook illustration, art photography"
DF39158C-97F3-CE67-66BB-E70B32C51F7E,"a black cat sitting on top of a stack of books with green eyes and tail curled up on top of each other, Charlie Bowater, glowing eyes, a storybook illustration, vanitas"
5F9AAEA4-A1C5-FF2F-9DC0-B409B34EF29D,"a book with a picture of a girl and a man on it with the title under tale written on it, artist, detailed art, a child's drawing, context art"
584F00B0-E9D0-5051-BDF4-10A9F1D4F0F6,"a bunch of trees that are painted in different colors and shapes, with a gray background and a blue sky, Cedric Seaut (Keos Masons), concept design art, concept art, environmental art"
F48F1575-E443-23F0-163E-B444D2C4F697,"a man and woman dressed up as corpse bride and groom holding hands and walking a dog in a field, Dirk Crabeth, gothic, a storybook illustration, international gothic"
674A3CDB-CD2D-E313-03AD-1A16F87181B5,"a cartoon dog sitting under a tree with a hat on his head and a bag of food on his lap, Alejandro Burdisio, magic the gathering artwork, a storybook illustration, fantasy art"
1E6122C6-9558-2AE4-1BC3-71C47D65DF07,"a baby dragon is in a basket with a stuffed animal in it's lap and a blanket on top of it, Cyril Rolando, dragon art, a storybook illustration, fantasy art"
837CDCE4-EA60-AA91-CC74-38FFDFCF3AC5,"a group of different types of animals and birds in a group together on a white background with a person standing in the background, Adam Rex, epic scale, concept art, sumatraism"
68DD6BF3-4C7B-5E98-A0CA-58A6EFE69BFC,"a lion with a crown on its head and a purple background with the words, basic brushes for adobe photoshop, Edwin Georgi, trending on art station, an ultrafine detailed painting, action painting"
5B646481-D21A-740C-D01D-E5963D007E04,"a bunch of different types of cartoon characters in different stages of writing and animation, with a few different characters in the same section, artist, professional digital art, a comic book panel, context art"
C0A08EEF-2FFE-47DA-9F32-1C11F643E298,"a man with black hair and a black feathered coat on his head and eyes, staring at the camera, Aya Goda, stanley artgerm lau, a character portrait, fantasy art"
2BA0FC7D-1DB2-6244-0A0E-588B02F354CB,"a cat sitting on a cloud covered hill with a sky background and stars in the sky behind it, and a full moon in the distance, Cyril Rolando, dark background, concept art, fantasy art"
26958543-FB8E-3B6A-489E-35BC2F646E44,"a drawing of various eyes and eyebrows with different colors and shapes on a piece of paper with a caption, Artgerm, realistic eyes, a detailed drawing, visual art"
E4BDCE50-3BCE-1ADD-D2D3-5C589C998E66,"a man holding a sword and a dog in the background with a sky background and flowers in the foreground, Cedric Seaut (Keos Masons), rossdraws global illumination, a character portrait, sots art"
8CC3D910-A106-88DC-88B5-9329950AF9DF,"a cup with a face and a bunch of pencils sticking out of it's side, with a small cup of colored pencils in the middle, artist, cute and funny, a child's drawing, naive art"
73A15619-D15F-35AC-45A2-EB49E6435001,"a painting of a person standing on a bridge looking at a moon and a forest at night with a full moon, Cyril Rolando, dark night, a matte painting, fantasy art"
D050D19D-9C16-4C90-6A9B-15F973A7500F,"a blue bird sitting on top of a finger with a star on it's wing and a ring around its neck, Chris LaBrooy, trending on art station, a digital painting, fantasy art"
A34A2F80-B7DD-2400-15F5-F110ADE4867A,"two black cats with glowing eyes and green eyes are looking at the camera with a creepy look on their face, Felix-Kelly, ghibli, a digital painting, gothic art"
527C264E-6988-664C-3A6D-947F464ABA3C,"a fire with the words photoshop and gimp brushes flames on it's side and a background of flames, David Imms, adobe photoshop, a detailed matte painting, photorealism"
B01928E7-2266-77AF-4286-CED06A011C38,"a bird flying over a mountain with a castle in the background and a tower in the background with a sky background, Chris Rahn, fantasy concept art, a detailed painting, fantasy art"
54B71D3E-5AF5-D44A-34E4-85800B4E71AC,"a cartoon character with a blue and purple hair and a black head with yellow eyes and a purple tail, Eddie Mendoza, pixar style, a digital painting, pop surrealism"
39A2FEAF-42A5-C725-91AF-B7CAFFE0CA2C,"a cat laying next to a jack o lantern on a table with a glowing jack o lantern in it, Anne Stokes, dark background, a storybook illustration, gothic art"
2B484ACE-6B2E-201D-443C-999FA2E8A486,"a person is drawing some art work on a paper with colored pencils and markers on it, and a drawing of a dragon, Anato Finnstark, dragon art, an airbrush painting, process art"
20366915-3748-AB2C-B21E-F210E0B7444D,"a rolled up dollar bill with a small piece of paper sticking out of it's end on a white surface, Christopher Williams, digital photography, a 3D render, conceptual art"
B6B55CD9-68EF-E1D5-F06E-8167FDC48930,"a drawing of a yellow candle with a smiley face on it's top and a black background behind it, disney, candles, a digital painting, digital art"
56905E33-8FC3-ED04-AD53-52E72840C828,"a black and white animal with horns and horns on it's head standing in the grass with trees in the background, Derek Chittock, trending on furaffinity, a surrealist sculpture, furry art"
9E90AE82-E140-CF03-1D48-4A7D13416190,"a woman with a blue umbrella and a red dress holding a book in her hand and a blue umbrella, Ayako Rokkaku, anime art, an anime drawing, fantasy art"
EC65B3A3-97CD-773E-5D17-F80EF1B017BD,"a painting of a waterfall with a tree and a waterfall in the background with birds flying over it and a waterfall in the foreground, Chris Rahn, magic the gathering artwork, concept art, fantasy art"
821513F1-BC51-0782-376B-AD3D191619FA,"a couple sitting on a rock in the water watching the sky with clouds and stars above them at night, Cyril Rolando, dreamlike, a matte painting, fantasy art"
710F30E2-15E8-5529-1B5B-4726899045E6,"a hand holding a notebook with a drawing of a cat and other cartoon characters on it and a pen, Diego Gisbert Llorens, ghibli, a detailed drawing, space art"
4FAE47B4-30FF-BF3D-1A7E-8EE20DF37B75,"a painting of a cabin in the woods with a river running through it and a tree house in the distance, David Martin, matte painting concept art, a detailed matte painting, fantasy art"
10E8C1CA-CAB5-5EA3-5C5F-2385A297E775,"a painting of a giant alien like creature in a forest with a man standing on a hill looking at a giant alien like creature, Clint Cearley, dragon art, a detailed matte painting, fantasy art"
75A31AC5-7007-D6EC-588C-6B271861A7B5,"a painting of a river and a sky with clouds in it and a blue sky with a white circle, Darek Zabrocki, clouds, concept art, environmental art"
9B51B3F5-53C5-B700-CCD4-1013EA60ACD8,"a fantasy landscape with mushrooms and a house in the middle of the forest, with a full moon in the sky, Anato Finnstark, league of legends concept art, a detailed matte painting, fantasy art"
B3C4B635-CCDC-CD17-F140-C74795598A80,"a painting of a boy playing with a dragon in a forest with a ball in his hand and a bird in his hand, Anato Finnstark, storybook illustration, a storybook illustration, fantasy art"
B1CEBBF8-1A46-36A1-D049-817B878AAFE5,"a white cat with a flower in its mouth and a red shoe on its feet, standing on a white background, amano, fullbody, an anime drawing, furry art"
4D0F93D4-3673-0366-E0ED-821BF6B62831,"a woman with a helmet and sword on her head and a sword on her head, with a sword stuck in her head, Charlie Bowater, trending on art station, concept art, fantasy art"
1141C683-2C0F-7E67-F3C7-B5CBA3FDEEB7,"a woman with a umbrella and a dress on her body is holding a cat and a bird in her hand, Fan Qi, beautiful detailed, a character portrait, gothic art"
5598D175-3DDA-58B7-C098-9B13FB7B6E4F,"a small animal with a flower in its hair laying in the grass with daisies on its head and eyes, Clovis Trouille, majestic, an impressionist painting, impressionism"
2AD0286C-97C9-E130-C0E3-7ADB66F5FA27,"a woman with a tiara and a star crown on her head and a star on her forehead and eyes, Charlie Bowater, trending on art station, a character portrait, fantasy art"
83D5557E-2B8D-1595-6E17-D7A52CBA545E,"a painting of a lion with its mouth open and teeth wide open, with a cloudy sky in the background, Chris Rahn, highly detailed digital painting, a digital painting, furry art"
8BB86C43-23A5-5A37-9A23-74FC10856781,"a cartoon character with a strange face and a dragon like head, standing in front of a fire and ice background, Adam Manyoki, epic composition, a detailed painting, sots art"
C5AC448E-2E77-0D34-093B-19EA78DBBF84,"a drawing of a umbrella and a clock on a book page with a pen and ink drawing of a woman holding an umbrella, Farel Dalrymple, illustrated, a storybook illustration, pop surrealism"
CB67967D-3D70-17D2-CA0A-1F926FFDF7FF,"a black and white photo of a black and white photo of a black and white photo of a black and white photo of a black and white photo of a black photo of a black and white photograph, Constant Permeke, fine foliage lace, a stipple, ascii art"
A3A930D0-A657-50C7-009A-FEAAACF1EDB9,"a black background with a clock and a clock tower in the distance with a red light on top of it, Carlos Trillo Name, black background, a cave painting, minimalism"
D47D9143-4CD6-1A58-64DE-67EA84D84C77,"a drawing of a girl with long hair holding a pipe in her hand and a bookcase behind her, Clarice Beckett, official art, a character portrait, mail art"
3FB4A7A4-17A8-4768-6008-5EB35128EC64,"a fantasy forest with a waterfall and a waterfall house in the middle of it, surrounded by trees and other plants, Cedric Seaut (Keos Masons), league of legends concept art, concept art, fantasy art"
4085731E-9CD8-86FF-EA36-57FA1FCEDC29,"a computer generated image of a ball and a group of balls with a hole in the middle of the image, Beeple, ambient occlusion, an ambient occlusion render, net art"
7F199259-6AD6-AAFE-C8A6-87BAF867F236,"a woman with a bird on her head and a dress on her body, standing in front of a snow background, Charlie Bowater, rossdraws global illumination, concept art, fantasy art"
8BFB1900-8F1E-CB8F-224E-84F5D55663A1,"a cat in a raincoat holding an umbrella in the rain with a shark on it's back, Diego Gisbert Llorens, trending on art station, a storybook illustration, pop surrealism"
246FF32D-78E4-3E46-C0E2-8C856DCFEE3A,"a man and a woman are in a forest with a dragon and a girl in a pink dress and a dragon, Cyril Rolando, storybook illustration, a storybook illustration, fantasy art"
EFB352D5-648C-9669-07BF-787A08E4AD0C,"a large blue dragon with a smaller dragon sitting on it's back legs and a smaller dragon standing next to it, Chris LaBrooy, league of legends concept art, concept art, furry art"
664E5C71-ECA5-E2C7-3EE3-2AA7CFA82B93,"a woman wearing a hat and glasses with long hair and a black jacket and a hat with gold buttons, Dirk Crabeth, steampunk, a character portrait, fantasy art"
32982A19-E65A-2B26-CA26-0838BA070607,"a small kitten is sitting in a bowl of milk on the ground, looking at the camera and drinking milk, Carlos Catasse, tiny, a stock photo, lowbrow"
5C318461-248A-E902-9CFC-87369A7DE328,"a cartoon of a black animal with a red shirt on it's chest and a black nose and nose, Carles Delclaux Is, cute and funny, concept art, furry art"
4E80D097-C857-0F7D-C99D-291C7B6532CA,"a drawing of a person holding a baby in a cage with lines on it and a red line across the top of the cage, Diego Gisbert Llorens, expressive, a child's drawing, figuration libre"
CB679E90-3DAA-D2E2-1F4C-438524214CFD,"a drawing of a woman with long hair and different hairs styles and expressions, with different expressions, and a man with long hair, and a woman with long hair, Charlie Bowater, leesha hannigan, a character portrait, lyco art"
200C631F-8DE2-DD86-1F82-D81E5CAD749E,"a woman with long hair and a hoodie is in the bushes with her hand on her face and her hand on her chin, Charlie Bowater, fantasy character portrait, a character portrait, gothic art"
2A30427D-0DFE-DCA2-12F0-C006566377D8,"a woman with red hair and sunglasses on her head is standing in front of a spiral background with stars, Felicity Charlton, sachin teng, a hologram, space art"
D13D1F02-DBE9-29C6-2B1E-F19BED2F6538,"a drawing of a jacket and hoodie with different angles and sizes of the hoodie and the hoodie, Brom, fashion, a detailed drawing, lyco art"
60A8ED08-7C01-229F-0210-C033E6E07908,"a woman laying on a large tiger pillow with a tiger laying on it's back next to her, Cyril Rolando, anime art, a storybook illustration, furry art"
B6B4C0EB-0EA6-9417-2240-C19D956A5B0D,"a dragon with spikes on its head and a large body of water in the background, with a city in the foreground, Clint Cearley, dragon art, concept art, fantasy art"
3FF9446C-D721-2937-7CE5-BBB53F91BA3D,"a woman holding an umbrella next to a cartoon character in the rain with a cat on her head and a cat on her shoulder, Diego Gisbert Llorens, ghibli, a storybook illustration, fantastic realism"
9D1206DD-90D3-B138-A48D-75A63A938D13,"a woman holding a bird in a forest with a green background and a green background with a bird on her arm, Chen Jiru, epic fantasy character art, a character portrait, fantasy art"
DBA0A7B6-339A-9240-B637-3BD69BC72751,"a woman with blonde hair holding a sword and a man with blonde hair and a sword in his hands, Artgerm, rossdraws global illumination, a detailed painting, fantasy art"
D5B5E9CB-192D-C907-DDD5-FED6B3B7C8BD,"a small kitten walking across a cement floor next to a wall and a wall behind it is a shadow of a cat, Carlos Catasse, beautifully backlit, a photocopy, art photography"
2B5A880D-F0D2-EC87-D113-65493C12DC04,"a man riding on the back of a horse next to a dragon on a cloudy day with red smoke, Dai Jin, epic fantasy character art, a detailed painting, fantasy art"
5A1851AA-97B4-7CEA-759B-C6E0896D764E,"a blurry photo of a blue and purple background with text overlaying the image of a blurry image of a blue and purple smoke, Art of Brom, airbrush, an airbrush painting, photorealism"
