Deviation ID,Caption
234986F7-420B-666E-910A-F248FC27A543,"a man in a costume with a sword and a lot of people around him and a tree with a bird on it, Anato Finnstark, game of thrones, a detailed painting, fantasy art"
2B1A95D7-BD04-7236-B1EA-72E990029480,"a painting of a tree with red leaves and a bird flying over it in the sky above a rocky area, Anato Finnstark, magic the gathering artwork, a detailed matte painting, fantasy art"
2FDF54B0-3983-2F81-E04B-33156897CA13,"a dog is running on a hill with a lizard in the background and a blue sky above it is a painting of a dog, Cyril Rolando, highly detailed digital art, a digital painting, sots art"
CB1B5B07-F67B-6F8C-C58C-1FC2CDF5FD1E,"a painting of a woman in a black and gold dress with a fan on her head and a black and gold scarf on her head, Android Jones, intricate oil details, a gouache, qajar art"
ACABBA1C-B833-06DE-77BC-54FA454AF808,"a painting of a man standing in a field with a sky background and a full moon in the distance, Anton Fadeev, rossdraws global illumination, a matte painting, fantasy art"
7FE4A38E-A538-4C52-9E72-EC3F4136C942,"a cat laying on the ground with a cherry on it's head and a cherry on its tail, Chippy, green eyes, a macro photograph, pop art"
1D7F397A-5B52-AFE5-8584-B9787E185356,"a drawing of a man with a hairdow on his head and a book open to the page, Conrad Roset, llustration, a manga drawing, video art"
4C2E44F8-BC91-09B0-DEA2-5E2338702747,"three birds sitting on a branch with their wings spread out and one bird is flying away from the other, Chris LaBrooy, birds, an ultrafine detailed painting, fantasy art"
67568B6D-8A5E-07C4-EFAC-86B6517DADC6,"a drawing of a set of different colored eyes and their shapes and sizes are shown in the picture above, Artgerm, realistic eyes, an anime drawing, temporary art"
5C35AB74-50BD-2D9E-5DD2-163D101616A1,"a white cat holding a black and white stuffed animal in its paws and looking at the camera with a blue background, Cyril Rolando, cute and adorable, a photorealistic painting, fantasy art"
8A63B78F-0A0C-EF80-5EE0-D959999F74D5,"a man in a purple coat holding a bird on his arm and a sword in his hand, with a bird on his shoulder, Chris Rallis, magic the gathering artwork, a character portrait, fantasy art"
171CE014-FE64-619A-0A33-9A5FE28CC257,"a dragon with orange wings and a yellow beak on its back, with a red tail and tail, on a cloudy sky, Anne Stokes, dragon art, a detailed painting, fantasy art"
EC0CBAEB-2592-301B-3ABB-5D4590A8CD94,"a blue fish with a crown on its head is surrounded by bubbles and bubbles in the water, with a blue background, Abidin Dino, 2 d game art, a digital painting, computer art"
258BEE3A-D40A-B702-F5C0-5DE3B76380C2,"a small owl sitting on top of a branch with a scarf around its neck and eyes closed, with snow falling around it, Chris LaBrooy, winter, a 3D render, sots art"
D4BD3449-E2FA-8CF6-274A-48A80C450564,"a carved pumpkin with a picture of a boat on it and a pumpkin with a jack o lantern on it, Anne Stokes, incredible art, a silk screen, gothic art"
2019E755-6599-9934-F3E6-FDC2F3BF11EC,"a black cat sitting in a field of grass with a sky background and clouds in the background, with a yellow sky, Charlie Bowater, plain background, a digital painting, gothic art"
361FF727-7096-4C20-EB41-F108F6641088,"a group of women in red and black outfits with swords and blood on them, all dressed in black and red, Cedric Seaut (Keos Masons), league of legends concept art, concept art, fantasy art"
102A4C82-B6A0-7011-1DA1-90DEFF124A92,"a black and white photo of a pentagram logo with the word pentagram written in it's center, Derek Chittock, logo, a screenshot, net art"
52255EDD-4DBA-73A7-78E5-BE40A8FE5264,"a deer with antlers standing in the middle of a dark room with a fire effect on its back, Anato Finnstark, fantasy artwork, an airbrush painting, fantasy art"
49501472-4783-5158-0194-0192415C97F9,"a cartoon character holding a pumpkin in a pumpkin patch with a demon on it's back and a demon on his shoulder, Bálint Kiss, dragon art, concept art, furry art"
5AEEBBDC-4F5D-0072-577D-1EFD857F63FB,"a woman standing in front of a green background with rocks and leaves on it and a fireball in the air, Anton Fadeev, arcane, concept art, fantasy art"
60E9F92D-09B9-DCBB-0E9D-1E8598431865,"a red haired man with glasses and a red hair is talking on a cell phone and wearing a pair of headphones, Adam Manyoki, half body shot, a character portrait, rayonism"
1848479A-6C74-DEA0-10E8-C966971F081F,"a woman riding a surfboard into the sunset with birds flying around her and a bird flying above her, Cyril Rolando, sky, a matte painting, fantasy art"
8FD9E2EB-FE42-67C8-9B38-538FF26FE87E,"a cartoon of a elf talking on a cell phone with a green hat on his head and a green jacket on, Artgerm, stanley artgerm lau, a character portrait, fantasy art"
2D9C7219-D3AA-28B6-5E23-D680F2C8A22A,"a couple is sitting on a pier with an umbrella over their heads as the sun sets behind them and the sky is red, Cyril Rolando, dark fantasy art, a matte painting, fantasy art"
481A8140-5696-96C7-F2A2-50BB5662BE32,"a man standing next to a white dragon and a white wolf on a green background with a man in the middle of the picture, Anne Stokes, deviantart artstation, a detailed painting, fantasy art"
13227084-7EBF-1998-6B36-C4CB544F5345,"a man in a kimono is kicking a fireball with his leg up in the air and his shirt off, Dai Jin, action pose, concept art, dau-al-set"
78A4328F-BCCB-CF82-56BE-553C0CB88822,"a woman in a dress is holding a cell phone in her hand and a sky background is in the background, Drew Struzan, anime art, concept art, action painting"
EB09A6C5-6F7D-B14D-B3DC-1229529FC3D7,"a poster with different types of boats in it's stages of development and development, including the hulls of the hulls, Art & Language, professional digital painting, computer graphics, photorealism"
9BCAD343-A761-0317-C787-B269D15C1927,"a group of people standing next to each other with a speech bubble above them that says, i love you, Dustin Nguyen, animated, concept art, sots art"
544985CE-81F1-6A81-6920-DCD829E29E59,"a man in a costume with a mask and a jacket on his head and a jacket on his shoulders, Eddie Mendoza, conceptart, concept art, shock art"
89F0A9B2-3843-B67F-AFE9-29DAAA7C184F,"a painting of a river with a waterfall in the background and a mountain range in the distance with a few trees, Craig Mullins, art greg rutkowski, a detailed matte painting, fantasy art"
6757A5FF-E0A0-954D-8EC0-0012F83CF2B2,"a drawing of a girl with blue eyes and a pink bow on her head with flowers and butterflies around her, Artgerm, anime art, an airbrush painting, pop surrealism"
3351A321-0EBF-5C75-4D8E-101B6914A99B,"a piece of paper with a heart cut out of it and a piece of paper with a heart cut out of it, Fathi Hassan, love, a photo, conceptual art"
17884F11-CCEC-C99F-F114-47289D326329,"a black and white photo of a fish in the water with bubbles in it's mouth and a black border around it, Dong Kingman, m, a stipple, cobra"
FD82014E-B637-3BA7-6163-0A31BBA25ECA,"a group of people in a dark castle with a wizard on the stairs and a demon on the ground, Chris Rallis, magic the gathering artwork, concept art, fantasy art"
925A6180-5951-2255-2014-C6A4F1E1277B,"a man with red hair and a red shirt is posing for a picture with his arms crossed and his shirt is folded, Adam Manyoki, cushart krenz, a character portrait, photorealism"
69C373DB-399D-A9DF-D922-4CBAA458B277,"a scenic view of a mountain range with a green field and trees in the foreground and a blue sky, David Martin, beautiful landscape, a matte painting, german romanticism"
FD869F20-AAE4-1256-9DC0-BF11BE1DAF50,"a glass teapot with a tea in it and a book on a table with a blurry background, Dirk Crabeth, photorealistic imagery, a still life, art photography"
8D8E9F60-65C3-4612-123C-CB77EF3DF57C,"a woman with pink hair and a black outfit with lights on her chest and chest, standing in front of a black background, Andor Basch, rossdraws global illumination, a character portrait, fantasy art"
67D87C0E-748F-7862-3BF7-33828FA7459C,"a man in a white jacket and green headphones is using a cell phone in a rain soaked room, Cyril Rolando, anime art, cyberpunk art, photorealism"
763C8D44-1C16-948E-025F-9EB344DAFFAA,"a bunch of sketches of people in various poses and poses, all in different poses, and one in different poses, Artgerm, dynamic pose, lineart, process art"
A50437CC-95B8-C6FD-B3D1-EC2639E96D81,"a painting of a city with a statue in the middle of it and a river running through it with a castle in the middle, Craig Mullins, matte fantasy painting, a detailed matte painting, fantasy art"
8D67A7B9-E39D-A421-0D82-8005A693E9AA,"a ship in the ocean with a dragon on it's back and a ship in the water with a boat on it's front, Anne Stokes, magic the gathering artwork, concept art, fantasy art"
8E2A8E8E-9989-4FFD-B1C9-D3F4AA6E69F6,"a group of different costumes with different designs on them, including a dragon costume and a dragon headpiece, Derek Chittock, features intricate detail, an illustration of, furry art"
95B92813-41EB-A426-FEC1-405F08586D04,"a group of birds sitting on a wire with bats on it's sides and bats on the ground, Anato Finnstark, birds, a storybook illustration, massurrealism"
CBE92588-350A-FADB-2482-63CBEA8A7DCF,"a woman in a red dress holding a sword in a forest with trees and branches in the background, with a red ribbon in the foreground, Chen Chi, sachin teng, concept art, context art"
4DBD807C-C900-D897-061D-471F29CB01C7,"a yellow smiley face with eyes and a cigarette in the mouth with smoke coming out of it's mouth, Dom Qwek, hyper realistic face, a photorealistic painting, pop surrealism"
45F08CE6-3D03-3312-5502-2535C18CCE42,"two cartoon cats are dancing on a purple and blue background with a pattern on it and a caption below, Derf, blue and pink color scheme, a character portrait, synchromism"
75D0F963-F14D-72A3-9170-7E7695D9B47B,"a man with a gun in his hand and a red background with fire and smoke around him and a black background with red and orange circles, Eddie Mendoza, deviantart artstation, concept art, action painting"
5138F7D7-097B-8A09-A89C-CE6B16E08661,"a picture of a cartoon animal with eyes and nose on a plate with a forest scene on it and a house in the background, Brom, forest, a gouache, environmental art"
728945C0-AE1F-3B21-B12C-9D2182C5A98E,"a man with a sword in a cartoon style with a fire in the background and a mountain in the foreground, Dai Jin, official art, concept art, fantasy art"
AD2B72B5-A09C-2009-0D32-4EEA2E2B805F,"a person walking through a forest with a gate in the distance and a person walking in the foreground, Anton Fadeev, league of legends concept art, a detailed matte painting, fantasy art"
44E2EF25-5067-4784-F0AB-94D1DABA2CF2,"a cartoon character is holding a banana next to a cat in a costume that is wearing a costume that looks like a monster, disney, pixar and disney animation, a fine art painting, pop surrealism"
A93EC277-A62A-ADF1-1E16-0AF004190646,"a drawing of a girl with long hair and eyes is shown in a notebook with a pen and a drawing of a girl's face, Charlie Bowater, sketch, a pencil sketch, photorealism"
3BA8E94E-E708-8ACB-E65C-F8E316153820,"a woman with black hair holding a gun in her hand and looking at the camera with a blue background, Cyril Rolando, anime art, an anime drawing, gothic art"
BF16FE09-D7C8-095C-A096-CFC6782907F1,"a group of people standing next to a giant dragon in a forest of monsters with wings flying around them, Chris Rahn, league of legends concept art, concept art, fantasy art"
8D1DDEB2-44CA-27CB-7C3C-CDDB90349BD2,"a painting of a man with a sword on a easel with a painting of flowers behind him and a phone in the background, Alvan Fisher, watercolor, a watercolor painting, plein air"
3464930C-299F-0236-B0FB-18B41268DEE4,"a man in a futuristic suit holding a gun in his hand and looking at the camera with a steampunk background, Aleksi Briclot, cybernetic, cyberpunk art, afrofuturism"
CE0F3C7B-A9FD-0EC9-1999-BC6707079D6D,"a cartoon dog sitting on top of a cardboard box with a hot cup of coffee in it's mouth, David Teniers III, toy, a digital painting, furry art"
C9927226-226B-8EB4-C143-34AF9B4A9E84,"a woman sitting on a fence with a bird on her shoulder and a city in the background with stars, Cedric Seaut (Keos Masons), anime art, concept art, auto-destructive art"
EC073D53-5A43-22D2-5978-9BC814C8E060,"a drawing of a blue and white hedgehog with feathers on it's back and eyes, with a white background, ESAO, ice, a color pencil sketch, fantasy art"
F9005DAE-B0F0-8A53-E1F7-971ACB57C6BE,"a small heart shaped pendant is on a hand with a chain around it that is attached to a chain, Dirk Crabeth, anatomically correct, a surrealist sculpture, gothic art"
2FE89FBA-6238-5740-5B04-8D8721FC3DBA,"a couple of people on a horse in front of a dragon and a man on a boat in the water, Andreas Rocha, dragon art, concept art, fantasy art"
1A1423DF-40A6-365C-84D1-03192521721D,"a couple of animals that are sitting on a bench together in a room with a window behind them and a person holding a phone, disney, movie scene, a detailed painting, furry art"
82DF1DF3-21B1-5E67-4B2D-3B8201A263E5,"a person standing on a hill near a lake with a dragon flying over it at sunset or sunrise time, Anato Finnstark, dragon art, a painting, fantasy art"
190393A7-89AA-6500-B9E2-6EB4499E0E2F,"a bird perched on top of a pine tree branch with cones and cones on it's head and a pine cone on its head, Chris LaBrooy, digital illustration, an illustration of, digital art"
B6693CB5-DF29-E12A-66F8-7C4699C648B7,"a cartoon character holding a sys in his hand and a green tube attached to it with a green tip, Dr. Atl, trending on art station, concept art, neoplasticism"
D89858FB-9FAA-7094-ABF3-51BBBEDCBA23,"a painting of a waterfall in a forest with a man standing on a rock cliff looking at the waterfall, Christophe Vacher, matte fantasy painting, a detailed matte painting, fantasy art"
A591597F-C79F-720B-45E7-EF84A9668729,"a woman with a long braid holding a stick and a sword in her hands, with a white background, Charlie Bowater, epic fantasy character art, a character portrait, fantasy art"
F6D92491-C938-BBAF-70C6-E6279EA4E71B,"a cartoon picture of a dog laying on a plate with a stack of pancakes on it and a bottle of syrup, Dan Content, trending on art station, concept art, american scene painting"
56EC0E9C-9144-0DC8-3D12-85BB87341FCC,"a couple of anime characters with short hair and a black shirt on, and a pink background with a black and white image of a woman with a short hair, Atey Ghailan, short hair, lineart, art deco"
CB657AF8-6B2F-2ED2-68FD-E472D6EE3ED4,"a skeleton with glowing blue lights in a dark room with a clock and a skeleton on it's arm, artist, anime art, an ultrafine detailed painting, space art"
32E96D52-2663-E353-66FE-72FEFCF86862,"a woman in a black and white outfit with a black glove on her hand and a black and white outfit on her shoulder, Eizan Kikukawa, official art, a character portrait, purism"
2AE37C61-6A7E-14A4-3385-788826D57F07,"a dragon with a sword in its mouth flying through the air with a sky background and clouds in the background, Daryush Shokof, dragon art, concept art, fantasy art"
34B89C56-A72A-2950-E03D-4EF31F06557E,"a watercolor painting of a dragon on a rock with leaves on it's back legs and wings, Brom, dragon art, a watercolor painting, fantasy art"
333FE609-32E3-2883-8FA2-7B7423A78F47,"a boy riding a bike with a shadow of a bird on the wall behind him and a bird flying over him, Clint Cearley, edward hopper and james gilleard, a storybook illustration, fantasy art"
BEB9C07A-E889-2987-E002-92F1DACB86E5,"a black cat sitting in the grass with yellow eyes and a bush in the background with pink flowers and green grass, Carlos Catasse, green eyes, a portrait, gothic art"
7C0B7287-8BE6-C95C-AB47-95942112E960,"a penguin with a crown on its head sitting on an iceberg with a toothbrush in its hand, Diego Gisbert Llorens, key art, concept art, fantasy art"
A5591EAD-CD82-5C30-4B74-0DA8A1F67ECA,"a painting of a mountain range with a purple sky and birds flying over it and a purple sky with a few clouds, Anato Finnstark, matte fantasy painting, a matte painting, fantasy art"
0AB8ACB5-5973-AFDB-1F70-C51F55B3A2F2,"a cat with its eyes closed laying down on a bed of fur with its eyes closed and eyes closed, Carlos Catasse, eyes closed, a photorealistic painting, dau-al-set"
3151A389-0616-0F3B-4AA8-D65030AA839F,"a cartoon girl sitting at a table with a pizza and cheese on it, surrounded by other food items, Dom Qwek, da vinci, a character portrait, pop surrealism"
D33BCA46-66F3-DF6A-92EF-58E6BF753F55,"a couple of anime characters with different hair styles and hair colors, and a drawing of a couple of anime characters with different hair colors and hair styles, Akihiko Yoshida, 2 d sprites, concept art, process art"
5A067D4E-3CF3-80C6-1D5C-8BCDCA8473BE,"three women in dresses with long sleeves and a veil on their head, one in a gown and the other in a gown, Charlie Bowater, fantasy style, concept art, art nouveau"
B631A6DB-0EEA-EFCB-9141-CF1599A4A64D,"a city with a giant dragon like structure in the middle of the water at night time with lights on, Chris Cold, league of legends concept art, concept art, sots art"
69C45E0F-A418-0991-8189-E9AD1371AC15,"a painting of a group of people and a dragon in the snow with a man on a horse in front of them, Chris Rahn, dragon art, concept art, fantasy art"
68608E77-3602-1CF3-A444-FDD7203D304C,"a rainbow is shining in the sky above a blue planet with a rainbow in the middle of the image, Cyril Rolando, anime art, a matte painting, space art"
27DF24CD-57A7-A488-8D7D-11C6BE9924EE,"a group of people standing on top of a cliff in a city at night with lights on the buildings, Bastien Lecouffe-Deharme, dystopian art, cyberpunk art, fantasy art"
C072E828-8E65-9C76-E264-EDCDF72F28A7,"a man sitting on the ground with a pencil drawing of a man with a camera on his shoulder and a pencil drawing of a man with a hat on his head, artist, detailed drawing, a detailed drawing, photorealism"
29227658-DD36-5C14-E312-A60D3F8B298C,"a street with a lot of buildings and a cloudy sky above it and a crosswalk in the middle, Andor Basch, colorful clouds, a matte painting, fauvism"
89EDE90D-81E3-F231-8D80-A42899033946,"a girl with a fire breathing hair and a fire breathing face, is surrounded by trees and a forest, Brom, turnaround, a storybook illustration, auto-destructive art"
456E0B61-8441-5CF0-E955-310D5D27D320,"a drawing of a cartoon character's eyes with different expressions and expressions to describe them in the text, Artgerm, realistic eyes, a detailed drawing, process art"
68617931-9690-5B5C-A1F9-E01ECE19F5E2,"two birds flying over a wheat field under a cloudy sky with a dark sky in the background and a few clouds, Chris Friel, birds, a matte painting, art photography"
9B4E7522-ED7A-01CF-EA64-310314F77586,"a dog with a bow and a girl in a forest with a bow and arrow on its back, sitting on a log, Bayard Wu, league of legends splash art, a detailed painting, fantasy art"
02B93E66-50DC-3235-3C68-7247F94C4386,"a painting of a man and a bird flying over a mountain valley with a river and forest below it, Anato Finnstark, matte fantasy painting, a matte painting, fantasy art"
F351AA26-7732-4EC9-EFD3-7E27AF9EB106,"a small green turtle sitting next to a light bulb with a drawing of a light bulb on it's head, Chris LaBrooy, luminous, concept art, digital art"
46D3F9C4-C2FE-82BD-D49E-1AFC90C5FAB0,"a man holding a sword and a sword in his hand while standing next to a fish and a sword, Dai Jin, lostfish, a character portrait, fantasy art"
CDB1A18B-9908-9C42-C8B1-E6C6A6409129,"a cross stitch pattern of flowers and leaves on a black background with a white border and a pink flower, Chippy, bravely default inspired, pixel art, pixel art"
E814A1BA-490D-8FBD-BC23-CC3C82C81A8A,"a series of textures for a texture pack 17 of the textures are in different colors and sizes, and the background is black and white, Anson Maddocks, detailed textures, an ambient occlusion render, generative art"
2AFE72C3-B5BF-D35C-C480-47AE9DEE1039,"a rabbit and two chickens sitting on top of each other on a table with a blurry background of trees, Beatrix Potter, animal photography, a microscopic photo, assemblage"
9DC37F0C-A321-EC17-A153-5F3405270D64,"a drawing of a woman holding an umbrella next to another woman with an umbrella on her head and a mirror behind her, Du Jin, trending on art station, a storybook illustration, cloisonnism"
B9E385DE-F7CB-2CB0-F287-48CAC3CBC4B0,"a group of people standing on top of a beach under a cloudy sky with a sky background and clouds, Cyril Rolando, anime art, a matte painting, fantasy art"
ADA706C5-EDD0-BF11-2063-82EA48643839,"a giant creature floating in the sky above a bunch of other creatures in the clouds with a sky background, Darek Zabrocki, matte fantasy painting, a matte painting, fantasy art"
F63564E7-1BA4-D89B-1809-D61A12F7B547,"a painting of a woman with flowers in her hair and eyes, with snow flakes on her face, Anna Dittmann, winter, a detailed painting, fantasy art"
E90B23EF-CB3E-F7EE-1078-F6BE05A112E4,"a woman's face with butterflies flying around her head and a white background with a blue sky and a white sky, Anna Dittmann, watercolor, a watercolor painting, figurative art"
586E06EB-4682-5CB4-D535-861486F9450A,"a painting of a white horse with a sword in its mouth and a group of people in the background, Cedric Seaut (Keos Masons), trending on art station, concept art, fantasy art"
D93C51E6-05FD-2054-7AB3-B9A55184FE23,"a drawing of a person with a hat and a cat on his shoulder and a dog on his shoulder, Dustin Nguyen, pokemon, a manga drawing, modern european ink painting"
C558A5C2-2695-80F4-3AE5-D2A56D9BED0B,"a drawing of a jellyfish and a fish in the air with a caption that reads jellyfish, Felix Octavius Carr Darley, jellyfish, a storybook illustration, pop surrealism"
DDA3A7C9-1C8B-8624-5B43-740A30C9D9FF,"a woman with blue eyes and a white hair and blue makeup looks into the camera with a serious look on her face, Charlie Bowater, fantasy character portrait, a digital painting, pop surrealism"
07D85DDC-AF86-1B05-5517-205ABB06E067,"a painting of a pagoda tower with a rainbow in the sky above it and a rainbow in the sky above it, Anton Fadeev, matte fantasy painting, a matte painting, fantasy art"
160AE40F-6C65-46A8-48D2-6546009C808F,"a tiger is walking through a hole in the floor of a mall with a river running through it and a mountain range in the background, artist, incredible art, chalk art, fantastic realism"
618AF22B-A555-B3EB-BCC7-958740FCE993,"a girl with a mask and a stick in her hand and a forest background with skulls and trees and a cat, Alice Prin, 2 d game art, concept art, fantasy art"
DE6CBA59-929C-2DDA-29D7-30E2AE102C5A,"a person is drawing a picture of a tiger on a paper with a marker and a pen on it, Artgerm, trending on art station, an airbrush painting, furry art"
3BC28981-BE32-8D38-AD64-EC3D5098170A,"a painting of a forest with a waterfall and a tree trunk in the foreground and a person standing in the distance, Andreas Rocha, matte fantasy painting, a detailed matte painting, fantasy art"
79283CB7-9EE6-29B0-53CA-4BFFDF31AB79,"a pumpkin with owls sitting on top of it and a bird sitting on top of it's head, Diego Gisbert Llorens, trending on art station, a digital painting, pop surrealism"
73E7B321-447F-D71D-8B5C-6DD9F7031595,"a woman standing in front of a flock of birds with a hood on her head and a black coat over her head, Atey Ghailan, birds, a character portrait, gothic art"
BF3853CE-9EDF-B0B8-A835-89903EA8058C,"a woman with long hair and a black shirt on, and a green and pink background with a pink and blue background, Artgerm, rossdraws global illumination, a manga drawing, photorealism"
67886650-FDB9-F437-1274-E8BB3F1B89C8,"a computer generated image of a flower with a purple center and a blue center and a light purple center, Android Jones, fractals, a digital rendering, analytical art"
672F4A9A-70A8-43D0-E0BA-1E933E717B34,"a painting of a sky with clouds and a green frog in the middle of it's image,, Chris LaBrooy, octopus, an airbrush painting, fantasy art"
65EB93BC-3C86-ACD7-68E4-5738DE174757,"a man riding a horse with a sword in his hand and a demon on the back of it, in a fantasy setting, Art of Brom, epic fantasy character art, concept art, fantasy art"
827CDF0B-24E7-9A71-0673-79B33EF88732,"a lion and a baby lion sitting on a cloud filled sky with stars in the background and a bright light shining through the clouds, disney, trending on art station, a storybook illustration, sots art"
8A3B1E3A-B15C-3BDD-1BD2-0CA22DAE1161,"a painting of a dragon with its mouth open and its wings spread wide, with a sky background and clouds, Chris Rahn, dragon art, an ultrafine detailed painting, fantasy art"
2AD0259F-4D99-9ACE-A48C-5F4F08105981,"a couple of people standing next to each other in front of a sky with a planet in the background, Armin Hansen, beautiful scene, a storybook illustration, neo-romanticism"
944613B3-A3B8-ED19-7078-D2B9F13B3359,"a waterfall in a forest with a purple sky and blue and pink lights around it and a sun shining, Cyril Rolando, waterfall, a matte painting, fantasy art"
D6E41E81-917B-9A8D-9FEB-20765F970ADB,"a drawing of a lion with a woman's face on it's face and a wand in her hand, Claire Falkenstein, fantasy illustration, a storybook illustration, auto-destructive art"
7698B7C0-F0AC-7BAE-EEE8-574A91AE4A24,"a cartoon cat holding a sword in a snowy forest with trees in the background and caption caption caption caption caption caption caption caption caption, Adam Paquette, character portrait, a character portrait, pop surrealism"
