Deviation ID,Caption
6797CD44-47EA-B405-9377-5D41D83F33FE,"a red fox is sitting in the grass and looking at the camera with a sad look on its face, Arie Smit, animal photography, a stock photo, furry art"
83750DFB-D23E-00A3-DF4F-D164A07DF605,"a tiger sitting on top of a rock in a forest with leaves and flowers around it's neck, Brom, cute and adorable, a fine art painting, fantasy art"
8F1ED8A1-88A5-861A-F83B-77916A1481A0,"a red panda cub walking on a tree branch in the forest, with a blurry background of trees, Alex Petruk APe, animal photography, an album cover, rayonism"
66D5BA39-C0D4-7A95-52FF-C0694149142E,"a bird flying through the air with its wings spread out and a lot of birds flying around it in the sky, Cyril Rolando, rossdraws global illumination, a storybook illustration, fantasy art"
1C127EBF-EFF7-7BC4-004D-0355A2856C05,"a man riding on the back of a horse next to a bird flying over him on a snowy surface, Clint Cearley, epic fantasy character art, a storybook illustration, fantasy art"
9D329FE5-C9C2-8514-FBC5-4775A239A8C9,"a bunch of different poses of a man with white hair and white hair, and different angles of his head, Charlie Bowater, rossdraws global illumination, concept art, generative art"
B39CF7AE-34ED-F0B5-B25E-A7440373D4CD,"a group of animals standing next to each other on a white background with a shadow of a man in the background, amano, pokemon, concept art, furry art"
D0819182-2D8D-ED19-9884-65D1B502B9E0,"a painting of a boat in the ocean with a whale in the sky above it and a boat in the water below it, Cyril Rolando, fantasy artwork, an oil painting, fantasy art"
713EBDF3-13A5-EDD6-94B2-AAE1F7A6EAF8,"a grunge texture of different colors and sizes of paper with a grunge effect and a text overlay, Dennis Ashbaugh, post grunge, an ultrafine detailed painting, abstract expressionism"
562D2B71-E8D9-BB82-4CBF-4ED827CC0C0F,"a screen shot of a web page with a small player button highlighted in the bottom right corner of the screen, Domirinic Fegallia, micro details, a screenshot, video art"
B2377FD0-F506-AA31-0387-AF1703199688,"a man riding on the back of a giant dinosaur next to a woman on a horse in a snowy forest, Anato Finnstark, epic fantasy character art, a storybook illustration, fantasy art"
99E317BF-5F36-52CC-B8AA-80B829AAE404,"a woman in a red dress walking through a forest with a black dog in the snow near trees and a red cloak, Anato Finnstark, forest, a storybook illustration, furry art"
E76354E2-1CCA-D0DC-97F7-A6FB8D5C9418,"a white wolf with blue eyes standing in the snow with a sky background and clouds behind it, with a white wolf with blue eyes and tail, Anato Finnstark, majestic, a detailed painting, fantasy art"
3780E986-A543-DA68-018D-E600EE80201B,"a painting of a wolf with a red ball in its mouth sitting on a bench with a mountain in the background, Baiōken Eishun, official art, a character portrait, ukiyo-e"
5277B780-B6EF-6E74-E61A-A8612545E2CA,"a set of four different types of flowers on a white background with a blue background and a white background, Epsylon Point, concept design art, concept art, context art"
741527F0-9A2B-0773-79DF-309C03AF3516,"a painting of a castle on a hill with a sky background and clouds above it, with a man standing on a cliff, Christophe Vacher, rossdraws global illumination, a detailed matte painting, fantasy art"
A77528CF-7D8B-734F-09FF-A20F273E1F1F,"a colorful owl perched on a branch in the woods, looking at the camera lens and the camera body, Anthony S Waters, animal photography, a photorealistic painting, surrealism"
0AA29B29-C6FD-F241-292F-2DE877B56F3F,"a painting of a deer in a dark forest at night with a moon in the sky above it and a tree in the foreground, Anato Finnstark, dreamlike, a digital painting, fantasy art"
DD447C2F-3C68-AF34-D18A-B8B79DE4E698,"a black cat with big eyes and a tail is standing on a pole with a light shining on it, Cyril Rolando, arcane, a storybook illustration, fantasy art"
7278A359-0FF3-B2F3-E137-0C46EF27DD4F,"a drawing of a man with a wolf head on his head and a book with a drawing of a man's body, Caspar Wolf, game art, concept art, furry art"
C8D16575-C7B7-3575-196C-0401635253AD,"a book with a picture of an owl on it's cover and a description of the owl on the cover, Fiona Stephenson, storybook illustration, a storybook illustration, mail art"
5521E482-E779-B032-E29D-E34A5F22E10B,"a picture of a bunch of different jewels and earrings with different colors and shapes of them, and a picture of a woman with a necklace, Artgerm, trending on art station, concept art, photorealism"
201CA5FA-E4EC-EE65-FA44-A2DF8CFECE8D,"a book with a picture of a man reading a book on it's cover and a drawing of a woman reading a book, Dustin Nguyen, llustration, a storybook illustration, auto-destructive art"
E19AEBAE-BC52-DB40-D6E9-197534254BE0,"a book cover with brush settings for paint tool saii, 40 brush settings for inking and painting, Charlie Bowater, abstract brush strokes, an airbrush painting, action painting"
7FCBF6C1-783A-4AE4-8322-9991CD34253A,"a bunch of pink flowers on a branch with leaves and stems in the background, with a blurry background, Florianne Becker, roses, a macro photograph, art photography"
C3912C26-FDB1-4AB2-FD63-06D1B04B23A1,"a bunch of different social media icons with a camera in the middle of them and a video game logo in the middle, Derf, behance hd, pixel art, pixel art"
96E482A3-1AD0-BD26-D4B6-F3EC1271C21F,"a painting of a dragon and a dragon on a mountain top with a sky background and clouds in the background, Christophe Vacher, dragon art, a storybook illustration, fantasy art"
9D0EE335-EF12-3854-1993-23A7BEF65765,"a couple of animals that are in the air together in space with a background of stars and a light, Brian and Wendy Froud, cosmic, concept art, psychedelic art"
9E9EB694-500A-D400-25AE-901815F73167,"a woman sitting on a ledge with a large colorful wing on her back and a building in the background, Clint Cearley, magic the gathering artwork, concept art, fantasy art"
804947F8-C03B-A455-9C92-FA08A5B2EEFC,"a drawing of a bunch of people with different expressions on them, all drawn in black ink, with a black background, Akira Toriyama, rob rey and kentaro miura style, a detailed drawing, neoplasticism"
C8376FF2-0398-3ED3-876A-4449CDE9B8AF,"a forest with a lot of trees and snow on the ground and sun shining through the trees and the ground, Dirk Crabeth, godrays, a matte painting, german romanticism"
70C6D3C3-8531-3B8A-2141-0BB70B5D1844,"a drawing of a cat with big eyes and a cat tail, with a curled tail, sitting on a beige background, Claire Hummel, big eyes, a color pencil sketch, pop surrealism"
C0AFFF3C-46DC-2E6B-ECA5-860FA0EB913F,"a woman with a leaf on her head and hands in front of her face, with her eyes closed, Cyril Rolando, trending on art station, a character portrait, fantasy art"
D4DA72F8-C7B0-54A3-673F-CADED59148BE,"a black and white photo of a line of trees with a black background and a white line of trees with a black background, Bob Ross, cable wires, pixel art, pixel art"
67DA0E35-1050-C374-5CC7-A16B3136F78F,"a bunch of different types of dragon heads on a white background, with a white background behind them, and a white background behind them, Brom, dragon art, concept art, furry art"
4C693688-6EC6-2B97-40DE-C8D48EAB636A,"a group of people standing around a bunch of pokemons and pokemon characters in a field of grass and trees, Alice Prin, 2 d game art, pixel art, pixel art"
1AC8F96E-09B6-F719-FD72-3A2A440E79F9,"a man is flying through the sky with a space shuttle in his hand and a space background with stars, Anna Dittmann, space, a detailed matte painting, space art"
F4FD8DA1-3C26-BF2C-9345-1D87394403DB,"a painting of a sky with clouds and stars in the sky and a field with grass and flowers in the foreground, Cyril Rolando, anime art, a matte painting, fantasy art"
CADDC4A2-AD1B-EB2B-C8CF-B77A81646B18,"a red flower with water droplets on it sitting on a rock surface with a rock in the background and a rock wall in the background, Dirk Crabeth, shallow depth of field, a macro photograph, art photography"
F9C3C030-655E-B264-2CC4-11BF30ECF905,"a castle with a boat in the water and a sky filled with lights above it and a bridge in the foreground, disney, magical atmosphere, a detailed matte painting, fantasy art"
565DADE6-B1C3-D651-B869-5D1A3E34C700,"a woman standing in front of a group of cats on her head and a cat on her shoulder, with a cat on her head, Cedric Seaut (Keos Masons), cushart krenz, a character portrait, furry art"
964E96CA-F9AD-BC79-FEA9-47E9DCA9728A,"a woman in a white dress holding a sword and a sword in her hand with a blue background and a white cloud, Fabien Charuau, final fantasy, a character portrait, fantasy art"
08588C61-0348-B1EE-2F56-16CE9D94CCA3,"a purple and blue space with a large bird in the center of it's image and a planet in the background, Anato Finnstark, nebula, a detailed matte painting, space art"
FCF28733-E3BF-481E-213F-85E0A42A5EA1,"a tree in a field with a sky background and clouds in the background, with a pink flowered tree in the foreground, A.B. Frost, pale colors, an ambient occlusion render, minimalism"
BDEBE4EF-CC05-202E-8435-535AABD991EA,"a cartoon character holding a glowing ball in a forest with a fire breathing creature in the foreground and a glowing ball in the background, Chris LaBrooy, 2 d game art, concept art, fantasy art"
23339AF6-6F7D-75CF-25C9-AECA79E08D94,"a man in a black coat and a dog in a city with tall buildings and a sky background with a blue light, Aleksi Briclot, magic the gathering artwork, cyberpunk art, gothic art"
15823869-E990-AEA5-7112-0D3E3BE2AEF0,"a green background with a girl with a blue hair and a green background with a white background and a green background with a white background and green background with a, Chizuko Yoshida, sticker, computer graphics, net art"
6121EE91-EB17-458E-BAB0-EF7A456964DA,"a book with a drawing of a woman and a bird on it, and a pen resting on top of it, Akihiko Yoshida, game art, a storybook illustration, fantasy art"
76251F34-5DF7-648D-5295-8D2E20D4932D,"a cactus with a flower in a pot with a white background and a caption that reads birdcaca baadi owl, Brom, trending on art station, a digital painting, digital art"
94D56DCA-BE12-3B05-8CE5-4C64C800DC15,"a cat is singing into a microphone with its mouth open and a disco ball hanging above it and a mirror in the background, Carlos Catasse, award - winning photography, an album cover, funk art"
D50826F8-D35D-EF3C-B13C-C9CF346C4571,"a clock with a musical note flying around it in the air with a blue background and a white piano, Alice Prin, rossdraws global illumination, concept art, kinetic art"
AFD0CA8B-160E-86B2-C104-CF6CC78ECAFE,"a woman sitting on a stool in front of a wall of pictures and paintings on the wall of a room, artist, trending on art station, a detailed painting, visual art"
E2924E42-B9FF-1EEC-7C50-992EF4D2E258,"a man standing in front of a store filled with people and a cat on the street next to him, Andreas Rocha, league of legends concept art, concept art, fantasy art"
5615D2E5-95C3-F3F2-16B9-CE2F192E8301,"a piece of paper with a smile drawn on it and a piece of paper cut out to make a smile, David Small, smile, a picture, conceptual art"
98E0369C-2F6C-E9DC-F365-F5C15F4AB304,"a woman in a white dress is holding her arms up in the air with a full moon in the background, Cyril Rolando, moon, a detailed painting, fantasy art"
02534639-13F8-7CCF-980F-F8D1F5FE837D,"a painting of a forest with a tree and a deer in the foreground and a forest with a lot of trees and bushes, Anato Finnstark, intricate environment, a storybook illustration, fantasy art"
81F0C15B-4C2B-91D3-D355-832D2F14EB14,"a painting of a bird with a colorful background and a sky background with stars and a green and yellow hue, Anato Finnstark, mystical colors, an airbrush painting, fantasy art"
11F49E51-222A-9AB5-7DE7-7C7EA4FFC1DF,"a cross stitch pattern with a thought bubble in the middle of it that says i wish i could draw what i'm in my bed, Chris Ware, sticker, a cross stitch, pixel art"
C9CC6F53-EB2D-C254-9168-984258807CD9,"a red panda cub is playing with his paw on a wooden surface in the forest, with its paws on the ground, Arie Smit, animal photography, a jigsaw puzzle, furry art"
7E879736-6DBA-5262-6935-8D22F87D8AED,"a green bird sitting on a branch with a bubble in its mouth and eyes closed, with a blue background, Abidin Dino, soft painting, a digital painting, fantasy art"
6B4ADCF9-F52A-B0CE-D14A-64311D8C5531,"a cartoon of a little boy and a fox standing next to each other, both wearing hats and vests, disney, pixar style, vector art, furry art"
67FDE81E-C234-EADD-B435-72A3E34DA9E5,"a painting of a tiger and a woman hugging each other with flowers in the background and a sky background, Brom, trending on art station, a storybook illustration, furry art"
F75CF232-C557-758A-F9ED-2604C555465E,"a painting of a tree on a mountain with lava and lava below it and a sunset in the background, Chris LaBrooy, matte painting, a detailed matte painting, fantasy art"
864FA76D-B601-A87A-69EC-EB50595E8985,"a demonic creature with horns and horns on its back, with a ring around its neck, in a dark, cloudy sky, Chris Rahn, magic the gathering artwork, concept art, fantasy art"
C99DDD1C-8CA9-FD7F-BE29-3A5094C3BA0A,"a boy standing next to a lion in a field with clouds in the background and a sky filled with stars, Cedric Seaut (Keos Masons), final fantasy, a storybook illustration, vanitas"
CE4B2EF3-C35A-EA07-AC9C-60280DD3ED59,"a person walking down a street with a umbrella in the rain and a reflection of a building in the puddle, Florianne Becker, digital photography, an album cover, art photography"
DCB2250E-DE49-6142-CE2E-EEE723B7DB22,"a poster with a picture of a mushroom and a fox in the background with the words photoshop brushes, Eve Disher, trending on art station, concept art, incoherents"
EA7A7702-8221-0927-A318-74E31E67790E,"a small rabbit sitting on the ground in the sun light, with its eyes closed and ears closed, with its head turned to the side, Beatrix Potter, cute and funny, a pastel, dau-al-set"
82BDDAB4-1AD0-5DE8-A5F2-61EE3A77D23B,"a digital painting of a weird looking creature with a huge head and large teeth and a massive body of mechanical parts, Android Jones, biomechanical, a character portrait, fantasy art"
8068930F-C552-8627-6270-F95816BB4B7A,"a metal object with a clock on it's side and a metal object with a clock on it's side, Boleslaw Cybis, steampunk, a 3D render, kinetic art"
921BD7C7-0F3E-4102-993C-89EB397F409D,"a picture with a quote about music and a picture with a smiley face on it that says the real trouble with reality is that there's no background music, Bob Ross, furaffinity, pixel art, pixel art"
EFD1144E-249D-028A-3873-C61CD20A40B0,"a woman standing next to a man in a forest with a demon on his back and a demon on his back, Brian and Wendy Froud, epic fantasy, a storybook illustration, fantasy art"
9C67C0E7-465E-0191-CDA8-645AC419C7F4,"a blue dragon is swimming in the water near a boat and a boat in the water with a boat in it, Anne Stokes, dragon art, concept art, fantasy art"
6A3BD4D0-4663-A44B-E27B-8191205EF2C7,"a painting of a seaweed and bubbles in the water with sunlight shining through the water and a person in the water, Cyril Rolando, underwater, a storybook illustration, fantasy art"
D26732F7-43FB-00CD-437B-9B83A77F6734,"a black hole with a ring of light in it and a star in the background with a black hole in the middle, David Martin, anamorphic lens flare, concept art, space art"
DE0DDB4C-4111-5566-783E-57FBDA50B8AE,"two ladybugs sitting on a green plant with leaves in the background and a blurry background behind them, Elke Vogelsang, macro photography, a macro photograph, art photography"
0013B17E-A2A5-DD47-F0C9-0800E1BDE60A,"a painting of a tower on a cliff in the ocean with a sky background and clouds above it, with a green tree growing out of water, Anton Fadeev, league of legends concept art, a detailed matte painting, fantasy art"
33A0E565-1946-9DFA-0AA4-ED2337130BB0,"a set of different colored brushes for creating a painting effect in photoshopped and photoshopped with a brush, Don Bluth, abstract brush strokes, an airbrush painting, action painting"
DCB1CE62-D691-3CAC-CBBD-75AB6AE1639A,"a tiger with red and black stripes on its face and body next to a red flower on a black surface, Brom, trending on art station, a digital painting, furry art"
812B1D06-56E4-0CB2-2234-65E01F791B59,"a man playing a piano in front of a clock with a clock face on it's face and a person standing next to it, Alice Prin, key visual, a jigsaw puzzle, kinetic art"
143EED7D-6FB0-E993-F070-022E39E36D40,"a cartoon of a link link link link link link link link link link link link link link link link link link link link link link link link link link link link link link link link link link link link link link link link, Eddie Mendoza, cel shading, concept art, sots art"
C8AAE22D-5027-ABDE-1997-0427BA6E75C2,"a boy and a dragon are in a halloween scene with pumpkins and a full moon in the background, Cedric Seaut (Keos Masons), dragon art, a storybook illustration, fantasy art"
0CC1C4BC-6A7F-8BF1-0529-C84EE3FEE9FC,"a painting of a white wolf with horns and a bird in the grass near a tree with green leaves, Anato Finnstark, overgrown, a detailed painting, fantasy art"
58AA2371-41E6-AAA7-3A9A-2CE2B8B61C89,"a person sitting at a piano in front of a fish tank with goldfish in it's water, Cyril Rolando, bioluminescence, digital art, fantasy art"
B0F8F41F-D4B3-E11A-7B3F-E596C4189B13,"a woman with green hair is brushing her teeth in a bathroom mirror with a toothbrush in her mouth, Evaline Ness, gradient light blue, a photorealistic painting, gothic art"
29DE7C9C-9480-2994-E548-64E4D2DCA506,"a digital painting of a cat with blue eyes and a white nose and tail, with a purple background, Cyril Rolando, professional digital painting, a digital painting, sots art"
07F1896E-9BAB-A699-FF4B-F19268BCD7E1,"a large white bird with wings flying over a forest filled with trees and rocks, with a man standing next to it, Brom, magic the gathering artwork, a detailed painting, fantasy art"
8742A02E-2530-73C1-8023-99A9B7803096,"three eggs with faces drawn on them sitting on the ground next to a broken egg shell with a sad face drawn on it, Else Alfelt, angry, graffiti art, shock art"
588CF03A-9B05-B15D-436F-C8FBC6ECF04E,"a drawing of a cat's eye with a pencil in it's eyelide and a cat's eye drawn in the middle, Artgerm, realistic eyes, a pencil sketch, hyperrealism"
9927ADFE-8D1D-54D3-1E73-2C356CF533AA,"a wolf is blowing bubbles in the air with leaves on it's tail and a blue background with green leaves, Cyril Rolando, translucent, a digital painting, furry art"
5C1F6B9A-2224-E9B4-D7BA-4DB93FE0FEDD,"two birds sitting on a branch with white flowers in the background and a blurry background behind them is a tree with white flowers, Chris LaBrooy, birds, a digital painting, neo-romanticism"
8C7CC846-C0A1-6F05-0DC4-2A99E92C9A4D,"a painting of a futuristic city with a dragon in the foreground and a bridge in the background with a mountain in the background, Anato Finnstark, matte fantasy painting, a matte painting, fantasy art"
BB416C55-36BC-0064-D51E-60938B0F250A,"a digital painting of a cat and a bubble of water on a blue background with green leaves and drops, Anato Finnstark, mist, a digital painting, impressionism"
E96FD312-77D9-580D-33C5-2CDCDE42D307,"a painting of a girl standing in a body of water with a city in the background and a dark cloud, Cyril Rolando, anime art, a matte painting, psychedelic art"
FEEF0F61-8DF4-7C56-876D-2318DE3FBB8B,"a black cat laying on top of a lush green field next to a forest filled with trees and grass, Charlie Bowater, soft painting, a digital painting, fantasy art"
3634F3A7-2355-B8A8-DCFD-CB9EF91887C3,"a lion with a long mane and a bright background with stars and a bright sky behind it, with a bright orange and purple background, Anato Finnstark, trending on art station, a detailed painting, furry art"
30CFEFFC-1536-3949-9D42-52A7402FA8BA,"a painting of a person standing on a wave under a sky with a lot of fish floating around it, Anna Dittmann, bioluminescence, a storybook illustration, rayonism"
F4961213-C77D-2FF9-F150-12B46D94ACFF,"a cat made out of paper with a creepy face and teeth and a tail with a flower on it, Alison Kinnaird, highly detailed and intricate, a surrealist sculpture, new sculpture"
C4813B94-7B16-B833-D89A-767164452844,"marshmallows with faces drawn on them in a cup with a handle and a handle on the handle, Farid Mansour, cute and funny, a pastel, art photography"
F9756C50-9617-3E81-FE4D-82B0389AC3A3,"a blue ink splattered with a white background and a black ink splattered with a white background, Diego Gisbert Llorens, abstract brush strokes, a watercolor painting, action painting"
5CAA5E76-F103-B4B0-E9FA-D8D31B22BF5F,"a man with glasses and a backpack standing next to a poster with a bunch of things on it and a person with a bag, artist, character sheet, a character portrait, analytical art"
7A1F4C2C-17CD-0285-23CB-465A6A54E145,"a dragon attacking another dragon with a sword in its mouth in a storm of clouds and mountains in the background, Anne Stokes, dragon art, concept art, fantasy art"
ADD6B1EB-38F2-383E-E3B7-27412D18FA46,"a pair of earrings with a key and a winged key on them on a sidewalk with a chain attached, Anne Stokes, steampunk, a surrealist sculpture, pop surrealism"
281F6054-5C54-160A-B3DF-91CB4E87A683,"a person in a black outfit and a red hat and a red and green jacket and a red and green hat, Adam Rex, rich vivid colors, graffiti art, toyism"
F67231CC-980A-2261-208C-E9E1867DAB58,"a computer screen with a picture of a purple galaxy in the background and a text box with a picture of a purple galaxy, Eden Box, matte painting, a detailed matte painting, space art"
E0BCBC89-EB59-B027-9D57-E1A5685D6A41,"a book with a picture of a deer on it's cover and a pen and ink drawing of a deer, Fiona Stephenson, perfect art, a storybook illustration, fantasy art"
7061D9D8-579D-AFB9-C6DC-A23D3C395BC3,"a space ship in the middle of a blue planet with a bright light shining on it's side, Chris Moore, mass effect, concept art, space art"
573A034C-3920-3D91-58EA-3CDCD44FC3E4,"a man standing in front of a giant creature in a forest with water and rocks on the ground, with a man standing next to it, Clint Cearley, league of legends concept art, concept art, fantasy art"
51208C88-A035-6075-AEC9-7AC219945F8A,"a cartoon of a cute little creature with autumn leaves on its head and arms, holding a leaf in its mouth, Brom, autumn, a storybook illustration, pop surrealism"
AA670576-F658-728B-40EB-EE8D452E4660,"a multicolored rose with water droplets on it's petals and a rainbow background with a caption that reads, perfectionion, Anne Stokes, rich vivid colors, a digital rendering, gothic art"
FFF011DF-6A4B-E7DA-8580-43AF7ECBBD5D,"a man holding a violin in his hands and wearing headphones on his ears, with a green shirt on, Cedric Seaut (Keos Masons), official art, a character portrait, analytical art"
6615C362-3ACD-5F6A-C3A6-85ADFEBB7FBA,"a crow is standing on a table with corn on it and a candle in the background, and a book and a candle holder, Brom, magic the gathering artwork, a storybook illustration, fantasy art"
7DD9CD69-5B36-5CB6-7685-5F26861CBDBD,"a bird flying through the air with its wings spread out and its wings spread out, with a person standing nearby, Dirk Crabeth, dark art, a 3D render, gothic art"
C53A1654-41CB-A258-A43C-50C93F00B46F,"a drawing of a man holding a bunch of animals on his shoulders and a shirt on his chest that says meat is murder, Benjamin Marra, dnd character portrait, a character portrait, furry art"
60740003-A0C3-5C99-5B55-A7C90A33EB70,"a stamp with a picture of two different characters on it, and the words, my fav character always dies, Derf, furaffinity, pixel art, pixel art"
856C1400-6244-4325-D492-2D426379BAB8,"a cartoon picture of a fox and a rabbit on top of each other's head, with a blue background, disney, heroic pose, a fine art painting, furry art"
1EE86024-4746-AE49-A327-A3EF7784E404,"a picture of a bunch of pikachu playing a video game on a table with a nintendo wii controller, Chris LaBrooy, game art, concept art, auto-destructive art"
81909B20-FA23-1C56-45A2-5A0CBD424E28,"a watermelon lion with a watermelon slice on its head and a tail, sitting on the ground, Diego Gisbert Llorens, trending on art station, concept art, pop surrealism"
D1956831-1CD2-A2FF-45CB-C6F860AAB40F,"a painting of a waterfall in a forest with a stream running through it and a light shining on the water, Andreas Rocha, matte fantasy painting, a detailed matte painting, fantasy art"
29625007-C9BF-0688-51B3-8003A733784B,"a collection of different colored swords with names on them and a description of the swords in each of them, Cafer Bater, fantasy concept art, concept art, dau-al-set"
70F5473C-F9C1-AFEB-02FC-BEE8F064CA0F,"a blue dragon with its mouth open and other marine creatures surrounding it, including a man and a dog, Adam Rex, league of legends concept art, concept art, sots art"
DA83AE36-D813-0C6B-57EE-8158EFA2DC3F,"a cat sitting on a ledge in the night sky with a full moon in the background and clouds in the sky, Cyril Rolando, dark background, a digital painting, fantasy art"
8B5C3868-C85B-CFF6-0557-B055C02B0F93,"a white dragon with its mouth open and two fish swimming around it, and a man standing in the background, Chris LaBrooy, league of legends concept art, concept art, fantasy art"
800AA9A7-A6F3-3462-6B22-1200196CAA2F,"a painting of a person standing in a forest at sunset or sunrise time with the sun shining through the trees, Anato Finnstark, volumetric light, a matte painting, plein air"
