Deviation ID,Caption
D88C979D-2D8A-9202-03E2-CEA41866641E,"a woman in a red dress standing in water next to a fish with a goldfish in it's mouth, Charlie Bowater, lostfish, a storybook illustration, fantasy art"
E7390C08-69F5-9362-1617-EBACBD991BFC,"two small brown and white hamsters eating a strawberry together on a table top with a colorful background and a blue and white wall, Chippy, berries, a microscopic photo, rococo"
21E01BF2-1520-1B1B-EE72-2E60F9447F68,"a painting of a boat in a body of water with a person in it and a fish in the water, Charlie Bowater, cushart krenz, a storybook illustration, fantasy art"
BF4D7DA8-6B96-B986-9A52-601C4708C507,"a dragon sitting on top of a pile of rocks next to a giant snake's claws and a glowing light, Craola, dragon art, an ultrafine detailed painting, fantasy art"
C027DEED-984C-9A34-4659-45055C04B3ED,"a woman with long blonde hair and a hat on her head and scarf around her neck, posing for a picture, Alice Prin, fashion photography, a black and white photo, art photography"
2BF39253-02DE-04E1-6C61-C04A3FAC806C,"a poster with different colored shapes and words on it's side and a free to use poster below, artist, pastell colours, a diagram, pixel art"
A1238423-4FA1-34A7-8E14-3FB99719C25A,"a leaf with drops of water on it's leaves, on a black background, with a dark background, David Martin, macro art, a macro photograph, art photography"
5C16CCA6-9D71-B43A-7C7C-1D8227F3434C,"a painting of a person standing on a hill with a sky background and clouds in the background, with a person standing on a hill with a kite, Cyril Rolando, wind, a matte painting, magic realism"
044BB78D-CEC5-10B5-39C8-91BFD3036750,"a couple of people with a cat and a dog in front of them and a robot on the other side of the picture, Evan Charlton, comic cover art, poster art, sots art"
5A5110DF-3810-30FE-9B22-CDAAAE47184C,"a series of photoshopped photoshopped with the words brushes by dark zabroskii on them, Darek Zabrocki, abstract brush strokes, concept art, action painting"
13648526-8BA1-B21F-3CE3-37E2DF4D3766,"a rainbow colored rose is in a vase of water and a black vase with a white vase behind it, Anna Maria Barbara Abesch, multicolored, a macro photograph, neo-romanticism"
3C1990DE-A7FC-F4DE-4211-77F931C6DB60,"a drawing of a woman with a sword in her hand and a blue background with a white background and a blue background with a blue border, Alice Prin, tarot card, a detailed drawing, fantasy art"
9E48FF3A-52A4-5FEC-7594-7CEC4330C258,"a dragon with a long tail sitting on a rock in front of a full moon sky with clouds and rocks, Anne Stokes, dragon art, a detailed painting, fantasy art"
5AA6B695-B0E2-34CF-0D43-D31C003B3B1A,"a large poster with a bunch of different colors on it's side and a line of lines on the side, Art & Language, triadic color scheme, a diagram, synchromism"
A3E3B622-657E-5EA2-389D-5075BE74F4ED,"a painting of a forest with purple trees and purple grass and a stream of water in the middle of the forest, Anato Finnstark, matte fantasy painting, a matte painting, fantasy art"
7D0F888E-623C-6858-CC90-C901DCD0764D,"a large poster with a bunch of different types of writing on it's sides and a few different words on the bottom, amano, adobe photoshop, a screenshot, computer art"
234E585D-374A-DA2A-BA5D-4DF5FAF8CC8B,"a girl sitting on a flying bird in the sky with a view of the earth in the background and a crescent, Cyril Rolando, anime art, a matte painting, fantasy art"
D71CC8C8-7D24-2412-EC01-DF8E3BA36E1D,"a drawing of a man with long hair and a beard with a beard and a beard comb in his hand, Conrad Roset, sachin teng, a screenshot, funk art"
9C5E9558-8E3F-F578-CB99-91480F8BC2C0,"a cartoon character with a knife and a flower in front of her face, with a blue background and a blue light, Felix-Kelly, angry, a character portrait, furry art"
E745881B-1031-5EB8-9595-AC0F6BBC9981,"a painting of dinosaurs in a river with a sunset in the background and a mountain range in the background, Chris LaBrooy, rossdraws global illumination, a detailed matte painting, primitivism"
787EC4CD-D92B-6228-E3F2-F2ECA658DACF,"a painting of a man standing on a cliff looking at a mountain range with a sky full of clouds, Anato Finnstark, fantasy artwork, a matte painting, fantasy art"
EB8A566F-B829-899F-C4DB-44E1CFF1F048,"a room with a lot of plants and a lot of windows and a staircase in it with a skylight, Evgeny Lushpin, rossdraws global illumination, a detailed matte painting, magic realism"
795F4116-AAE1-F002-FCFC-8153DBB141D1,"a key with a key chain attached to it on a stone surface with a key attached to it with a key, Evert Collier, steampunk, a jigsaw puzzle, assemblage"
6925362C-A243-DDC8-E153-3D0D34552C7A,"a small rodent is sitting in the grass with daisies in its mouth and looking up at the camera, Clovis Trouille, animal photography, an impressionist painting, impressionism"
A862BBBC-59B1-4E62-8186-BE2162E951A4,"a blue sky with clouds and a plane flying in the sky above it with the words cloud brushes above it, Bob Ross, brush strokes, a matte painting, photorealism"
C43A9920-BFF2-4CDB-AF94-C3BB6423BD95,"a drawing of a girl with a phone in her hand and a cloud in the background with a quote, Anna Dittmann, trending on art station, a watercolor painting, fantasy art"
87E63352-E0B2-3042-4FE4-4BE203105A04,"two birds sitting on a barbed wire fence eating something off of a flower in their beaks, with a blue sky background, Cyril Rolando, birds, a digital painting, lyco art"
0BBC31E2-5D61-8A7A-6E26-296BD73D0A01,"a woman with a red shirt and a blue sky in the background is looking down at her head and has her eyes closed, Charlie Bowater, stanley artgerm lau, a digital painting, digital art"
C7C26EEC-3FBB-61D6-CE04-DFE99FBED90E,"a man and a woman in a dress standing in front of a clock tower in the snow with a bird flying overhead, Charlie Bowater, cushart krenz, a storybook illustration, fantasy art"
4EEF8ADC-BE5A-80AF-CF1C-E11D01A2163A,"a jar of liquid sitting on top of a book with a tag on it that says love on it, Dirk Crabeth, love, a still life, art photography"
DB2C303C-944B-8DCB-E740-DB9ADA42CE5B,"a painting of a dragon with a lot of people around it in a field with a castle in the background, Clint Cearley, fantasy concept art, concept art, fantasy art"
A74A2C31-287A-0E1C-3070-8B2CFED79C1A,"a woman is holding a bunch of photos in her hands and a black background is also a black and white photo, Brad Kunkle, photorealistic portrait, an ultrafine detailed painting, analytical art"
D4953B2D-DDCD-95F7-9046-3FB36C9FB259,"a close up of a pair of scissors in a eye with a tree in the reflection of it's iris, Dirk Crabeth, realistic eyes, a digital painting, fantasy art"
D0950FC8-8A44-C5F8-5C95-94312DECE090,"a black and white picture of a cartoon character with a skateboard in his hand and a dog in the background, artist, cosmic horror, pixel art, pixel art"
0DE908EF-7D5D-A390-89E8-121B83A1328A,"a bird with orange feathers flying through the air with clouds in the background and a blue sky with stars, Anato Finnstark, magic the gathering artwork, a detailed painting, fantasy art"
69C91FAA-D98B-4122-0C87-975D71260565,"a horse with a green mane and wings on its back, running through a forest with trees and fog, Anne Stokes, fantasy concept art, concept art, fantasy art"
D5515AE6-FB04-E02B-0C03-070FFBB30FEC,"a black cat sitting in front of a red sun background with the words red sun written across it in white, Cyril Rolando, red, concept art, fantasy art"
FDCC59C4-92C6-65E1-3113-AEFB951F2E98,"a large number of different colored dots on a white background with a white background and a white background with a white background, artist, triadic color scheme, an ultrafine detailed painting, pixel art"
38AE94CD-0328-861D-F365-2E40C1BAA26E,"a train traveling down train tracks under a cloudy sky with power lines above it and a building on the other side, Ferenc Joachim, gloomy atmosphere, a matte painting, art photography"
EE190D80-17C0-9385-42FC-96CA386C3F31,"a wolf is walking in the snow alone in the dark night time, with snow falling all around it, Cyril Rolando, volumetric, a digital painting, furry art"
929D1D1A-FFDC-5B70-505E-FED497C657B1,"a painting of a mountain with a river running through it and a tower in the middle of the picture, Andreas Rocha, league of legends concept art, concept art, fantasy art"
A0BFDC1C-1B0D-823C-1B4F-1C181B8A14F8,"a ladybug sitting on a dandelion in the wind with its head turned to the side, Bessie Wheeler, macro art, a microscopic photo, ecological art"
096F1D23-F80A-526D-A718-6D5A05FC12C2,"a blue and pink cartoon character holding a small white object in its paws and a pink and blue object in its paws, Anton Fadeev, soft painting, a digital painting, furry art"
6A2F092D-95E3-8A02-EE31-E4513F975560,"a drawing of a turtle with a hat on its head and a green background with a yellow border around it, Chris LaBrooy, storybook illustration, a storybook illustration, pop surrealism"
16A2412D-1E46-E49F-6F13-DE8177A701C8,"a drawing of a hood with a hoodie on it's head and a hoodie on the back, Artgerm, concept design art, concept art, process art"
E45F115A-E642-1E1A-FE59-271FD8DA2B83,"a painting of a deer head on top of a book with butterflies flying around it and a butterfly trail coming out of it, Alice Prin, storybook illustration, a storybook illustration, magical realism"
3ACC1621-B9C4-A3C9-670E-A1F1B6E2D6AF,"a pencil drawing of a woman's face with a pencil in her hand and a pencil in her other hand, Charlie Bowater, realistic shaded perfect face, a pencil sketch, hyperrealism"
848B0DB9-869F-CD13-D811-8202DEE28260,"a group of cats sitting next to each other on a white background with a gray ribbon around it's neck, Carlos Catasse, character design, concept art, furry art"
0A7567AC-B776-42FC-95C5-EC2E07DDEB75,"a painting of a man standing in a river with a castle in the background and a mountain range in the background, Anton Fadeev, matte fantasy painting, a matte painting, fantasy art"
0E4DB685-1333-BDDA-2FD7-7AC0ABF72136,"a drawing of a wolf on a notebook with a pen and a marker next to it on a table, Anato Finnstark, in gouache detailed paintings, a watercolor painting, furry art"
A44A05F4-9F11-308B-9859-C4414ACF3AF9,"a woman with a flower in her hair and a flower in her hair, with a blue background and a black background, Charlie Bowater, highly detailed digital painting, an ultrafine detailed painting, fantasy art"
CF76C48B-539C-42C6-AC14-687FDD1F9170,"a man holding a cell phone in his hand with a broken arm and a broken arm behind him, with a broken glass background, Du Jin, stanley artgerm lau, a character portrait, auto-destructive art"
73683281-89C6-27CF-34A9-C3784A374C43,"a blue water background with water spouting from it and the words photoshop & gimp brushes water ii, An Gyeon, highly detailed digital painting, a detailed matte painting, photorealism"
610BA0BD-26F1-0184-E5CB-0A522AE487FB,"a blue animal with a green tail and yellow eyes is in the grass with a raindrop background and a dark sky, Cedric Seaut (Keos Masons), highly detailed digital painting, a digital painting, fantasy art"
45CAFFC3-FDB0-48F6-0F70-B6457550C3DF,"a printable game board for the game of thrones, which includes the main characters and their names, Chris Ware, character sheet, a comic book panel, context art"
192742C7-B570-1417-5363-28CA032D64EA,"a black and white photo of a sign that says lake sanfrasite hospital, with the words lake sanfrasite hospital, Dong Kingman, spectacular quality, a stipple, ascii art"
12A20FCF-9349-ECFB-A01A-C3AC2332A091,"a couple of anime characters with a black background and a red and yellow background with a blue and yellow background, Artgerm, pokemon, poster art, auto-destructive art"
706BC99F-182B-F450-8E3A-807BDED12AE4,"a painting of three birds flying through a cloudy sky with a sun in the background and a blue sky with clouds, Cyril Rolando, trending on art station, a digital painting, fantasy art"
6354F405-D332-D6DB-0F87-24C575D4A55D,"a cartoon of a baby pikachu and a big black dragon in a forest with trees and grass, Anato Finnstark, pokemon, a storybook illustration, fantasy art"
76D00DEE-1C5A-A1E9-72FD-04597ECB40FD,"a bunch of different colored eyes with different shapes and sizes of them, all with different colors and shapes, Charlie Bowater, rounded eyes, an anime drawing, gothic art"
06590453-B3D8-70AB-0F4C-12348E8EA78D,"a small black puppy chewing on a yellow shoelace while someone's feet are on the ground behind him, Dennis Ashbaugh, cute and adorable, a jigsaw puzzle, photorealism"
402CDEA2-6D49-38D1-0F71-FF7252116F24,"a group of people with guns and a woman holding a gun in her hand and a man in a white shirt, Drew Struzan, comic cover art, poster art, fantastic realism"
FCD55C4E-4D4D-7783-C590-8D3A0BB4ABE4,"a girl with green eyes and a hoodie on, in the dark with a blue light on her face, Charlie Bowater, angry, a character portrait, gothic art"
68D2BE48-0C7A-5C42-3524-32862A25B22C,"a painting of two cats in a forest with a light saber in their hand and a cat on the other side of the picture, Chris Rallis, fantasy artwork, a storybook illustration, fantasy art"
80852F67-96A7-36B4-61A4-109A3EBE0B6A,"a painting of a city at night with a lake and mountains in the background and a sky full of stars, Chris LaBrooy, matte painting concept art, a detailed matte painting, afrofuturism"
6CC42544-DF85-6827-D2EE-93D394A91658,"a large collection of clouds and stars on a dark background with a blue border around them and a black border around the edges, Bob Ross, airbrush, an airbrush painting, action painting"
D1C26D5A-2FDA-EDDD-5B2E-0E313B0AA2FF,"a white bird with wings spread over a body of water with a sun shining in the background and a pond with water lilies, Brom, rossdraws global illumination, a digital painting, fantasy art"
734A3783-9966-4C70-F61D-03398DC110C1,"a white wolf with red eyes sitting in front of a tree with red leaves on it's branches, Cyril Rolando, trending on art station, a digital painting, furry art"
A999381A-E854-5882-9993-74609A56F346,"a comic strip with a picture of a woman and a man in black clothes and a white head and a black coat, Ada Gladys Killins, epic scene, a storybook illustration, remodernism"
D6E4AC1A-7C6D-D8BE-A1DB-64A7FA91BA67,"a black and white photo of a tree with a white border around it and a black and white photo of a tree with a white border around it, Ernest Buckmaster, denoised, a stipple, net art"
4FAB3D4F-BE5E-6562-FE27-BC05402B0C74,"a group of people standing on top of a hill under a purple sky with stars and clouds above them, Cyril Rolando, stars, a storybook illustration, space art"
0F94BCBA-25B7-5085-986D-946ED67CFEC5,"a cartoon of a frog playing a musical instrument on a table with another frog sitting on it's back, Craola, fireflies, a storybook illustration, pop surrealism"
D340D93C-3AB1-033F-8ED9-98A86CF9049C,"a black cat with a fish in its mouth is laying down on the floor in the snow with its eyes wide open, Cyril Rolando, lostfish, a storybook illustration, pop surrealism"
755DC8A1-DB80-AC51-AE7B-B41F7F19A49E,"a woman sitting on a wave with a dragon like body and wings on her back, holding a bottle in her hand, Cyril Rolando, trending on art station, a storybook illustration, fantasy art"
C42C6EB2-1CE3-4F47-3792-A8031E904D0B,"a cartoon owl with a mustache and a green leaf on its nose sitting on a white surface with a blue background, Brom, soft painting, a digital painting, sots art"
11A77615-E4C3-B0AE-81FF-8E282204D667,"a bird flying over a dog and a cat on a cliff side with a sunset in the background and a bird flying over the dog, Christophe Vacher, magic the gathering artwork, a storybook illustration, fantasy art"
604B096A-F070-A8B9-51F4-C1C91A237531,"a calendar with a picture of two cats and a cat toy on it's side and a calendar with a picture of two cats on the front, Florianne Becker, medium - format print, a jigsaw puzzle, incoherents"
FEF12BD0-BF11-8C07-E915-837DD2F1D23C,"a dragon with a red hair is flying over a mountain and a full moon is in the sky above it, Cliff Childs, key art, a storybook illustration, fantasy art"
C78FF8E0-C906-EF92-88E3-9A37952ABC57,"a dragon attacking a ship in the ocean with a ship in the background and a boat in the foreground, Anne Stokes, dragon art, a storybook illustration, fantasy art"
EDD229CE-87F4-5A5C-9F88-5B7510DBFF31,"a drawing of a blue eye with different angles and colors of the iris's eyes, and how to draw the iris's eyes, Artgerm, realistic eyes, a photorealistic painting, photorealism"
A7783B87-EE62-23ED-6E00-6EC743A11FBE,"a futuristic city with lots of tall buildings and lots of people walking around it, with a sky background, Craig Mullins, league of legends concept art, a detailed matte painting, afrofuturism"
DFBC4BF7-5990-526D-15E6-FFC4123AB664,"a blue dragon with a black background and a white tail and head is shown in the foreground of the image, Anne Stokes, dragon art, a detailed painting, fantasy art"
B35019CE-3225-BA8A-8602-54529BDBF8D1,"a dragon with a man standing in the background in a cave with flames and smoke coming out of its mouth, Chris Rahn, magic the gathering artwork, concept art, fantasy art"
9F88A9F8-6837-35BD-BFA3-42A44601A608,"a group of people riding on the back of a white dog in front of a sky background with a fireball, Baiōken Eishun, official art, a poster, sots art"
0EDDDD64-EBC1-DD50-8DC4-9080BBCE555A,"a very colorful and abstract painting with lines and colors on it's surface, with a large amount of paint on the bottom, Bálint Kiss, windy, a comic book panel, mannerism"
7855CFD4-B771-54CD-1915-106AB6BE3429,"a girl holding a butterfly in her hand with a blue background and a pink background behind her is a blue background, Anna Dittmann, anime art, a storybook illustration, fantasy art"
0ED03C61-EF6D-8AD4-3D7F-7A852A7CD55F,"a cartoon skeleton with a red eye and a hat on it's head, sitting next to a bowl of bones, Dirk Crabeth, trending on art station, concept art, pop surrealism"
C0A8479C-0310-046C-2436-D2B9E5033CA2,"a drawing of a girl sitting on the ground with her hands on her chest and a bird with her head on her chest, Alice Prin, anime art, a storybook illustration, assemblage"
44B9AAF7-9FE2-9BDE-3EE7-F06976E5864B,"a book with a bunch of stickers on it that says kiwi and a picture of a beaver, Farel Dalrymple, character sheet, a detailed drawing, art & language"
991BC4AC-C4B0-237D-30F0-E384B1D872DF,"a drawing of a woman with long hair and a flowing dress with a bird flying above her head and a bird flying above her head, Anna Dittmann, bravely default inspired, a storybook illustration, fantasy art"
0EFA1334-3DF6-EF9C-349C-D37D31A0954F,"a path in a park with trees and leaves on the ground and sunbeams shining through the trees, David Martin, autumn, a matte painting, magic realism"
AB84C218-FFD8-8198-EB07-B6CED7569AD7,"a group of water lilies floating on top of a black surface with bubbles floating on it and a gold and white background, Filip Hodas, highly detailed digital art, a 3D render, cloisonnism"
BEDB7553-B33C-99F4-7E4A-ACF1F3B56393,"a group of women in different outfits and hair, with a dog and a cat in the background, and a picture of a woman with a dog in the foreground, disney, pixar and disney animation, poster art, magical realism"
F3EDCC95-0C34-AD7C-4A0B-73BBE01EB262,"a woman sitting on a rock with a dragon in the background and a sky background behind her, with a large blue dragon in the foreground, Cyril Rolando, dragon art, a storybook illustration, fantasy art"
254AE5E2-D35F-9E5B-04FC-F0132094EFCD,"a painting of two horses and a demon riding on a horse back in the desert with a man on horseback, Chris Rahn, dark fantasy art, concept art, fantasy art"
09C931DB-B114-2751-EF04-6F500657CD2F,"a castle is on a waterfall with a bridge in the background and a sunset in the sky above it, Christophe Vacher, matte fantasy painting, a detailed matte painting, gothic art"
61AC0336-D0C2-5252-DB15-05E5F02AC670,"a group of dragon like creatures in a cave with a bright light coming from behind them, with a mountain in the background, Anne Stokes, dragon art, concept art, fantasy art"
D2A28107-10D0-EB3A-D77A-A6F3EF368BD6,"a man walking down a street next to a tall building with a clock on it's side and a staircase leading up to it, Cyril Rolando, league of legends concept art, a detailed matte painting, magic realism"
35C41B0C-7F16-1701-BBD3-0B710110FD42,"a book with a drawing of a woman with long hair and a demon on it's back cover, Ada Gladys Killins, official art, an illustration of, gothic art"
82C1B47C-1944-EE89-B68F-F3C57E63BD28,"a painting of a city with a river running through it and a bridge in the distance with a boat in the water, Canaletto, dieselpunk, a detailed matte painting, photorealism"
F3FA6225-7840-939F-36E0-A6118F775971,"a white lion with wings sitting on a floor with a white background and a red light behind it,, Anne Stokes, majestic, a detailed painting, fantasy art"
06ACBA15-D518-318D-3350-02989D58A7BB,"a man riding a wind sail on top of a wave of water with a pink ribbon in his hand, Anson Maddocks, dieselpunk, a comic book panel, process art"
94AACDC7-EBAA-48EA-2640-E89018AB3CE2,"a tiger swimming in a pond of water with lily pads on the water's surface and a crescent of light shining on the water, Brom, tranquil, a detailed painting, furry art"
1150A747-A03A-2A00-1FAF-79811B58FB5E,"a woman with a red hair and a black shirt is standing in front of a group of girls with pink hair, Aya Goda, official art, a character portrait, context art"
722B6C28-0DD6-D36A-053E-27D30B10425B,"a cat is sitting in a tree with its eyes open and looking at something in the distance with a purple background, Anato Finnstark, dark background, a storybook illustration, fantasy art"
ED178B76-CFC3-D70F-69B7-41DFD6C03F15,"a large room with a chandelier and a painting on the ceiling and a painting on the wall, Andrea Pozzo, fantastically gaudy, a digital rendering, neoclassicism"
D63C37E0-C468-0F69-0F62-3B33F4CF63D8,"a four leaf clover is sitting on a mossy surface in the sunlight, with a blurry background, Benoit B. Mandelbrot, green, a macro photograph, art photography"
A4C1571E-C460-A23D-53D1-8676F65D9FBA,"a book with a picture of two people on it and a title page in the middle of the book, Ada Gladys Killins, official art, a storybook illustration, magic realism"
825EE562-CDE0-DECC-0044-4DE8DB6A43E7,"a group of people standing next to each other in front of a wall with graffiti on it and a neon green light, Cedric Seaut (Keos Masons), anime art, cyberpunk art, toyism"
D3B3FCA5-1F05-65EF-2F4C-376457F34AFA,"a cat is laying on the ground with its eyes closed and eyes closed, with its head on the ground, Carlos Catasse, animal photography, a stock photo, superflat"
C70D40FE-7D77-1B2C-CF00-62546BA97A06,"a painting of a dog sitting on a rock with a full moon in the background and a black background, Dirk Crabeth, sun, a digital painting, furry art"
A719A839-26D9-2E51-B7B8-89FD71F791F2,"a painting of a man in a suit and a demon in a fire pit with flames coming from his body, Eddie Mendoza, deviantart artstation, concept art, auto-destructive art"
4847CB66-0D08-E319-A9DA-8AB469DD0EB5,"a person standing in a green area with a sky background and a bridge over water with a building in the background, Alice Prin, anime art, concept art, magical realism"
37B1C5E2-DBEF-A56D-AFB3-19293C82EC7A,"a drawing of a person holding a green drink with limes in it and a slice of lime in the glass, Artgerm, ultra realistic illustration, a detailed drawing, photorealism"
6DC5BAF1-BDFF-C7B2-F337-0C89A8FFED2D,"a bunch of brush sets with different types of brush strokes and shapes on them, all in black and white, Eve Disher, abstract brush strokes, an airbrush painting, action painting"
6D781680-E6AD-3886-D98B-52761D453D86,"a group of cats standing in a row on a gray background with a star on the bottom of the row, Carlos Catasse, cute and funny, a detailed drawing, toyism"
4AE5861C-46C9-1356-920F-B8A10D2E8DD6,"a bottle with a cat and two fish on it and a ghost puppies on it's side, Craola, book cover, concept art, pop surrealism"
71BA22BC-E72E-44BA-2BC8-D96733BBEA1F,"two women with cat ears and glowing headphones on their ears, one of them is staring at the camera, Fan Qi, product photo, a character portrait, new objectivity"
6BFA86F6-B6C7-9363-E84B-0A346699C25C,"a woman with white hair and a black dress standing in front of a dragon with red eyes and a black bra, Artgerm, dragon art, a detailed painting, fantasy art"
5A64BF8C-B60F-7C12-C2AA-6F477DB73AE0,"a drawing of a hedgehog with a pink nose and a blue background with a white frame around it, Clovis Trouille, detailed art, a color pencil sketch, pop surrealism"
FD65B280-CB7B-9401-6B95-B7F15D618A6D,"a raccoon with blue eyes and bubbles floating in the air, with a green background and a blue sky, Cyril Rolando, big eyes, an airbrush painting, magic realism"
2B4735A1-97A4-237B-3393-85F4621133C3,"a dragon flying through the air with clouds in the background and a sunset in the background with clouds and a bird, Anne Stokes, dragon art, an airbrush painting, fantasy art"
0BF07752-5CC6-4D26-2E8C-1842583D244B,"a drawing of two cats with different hair colors and a cat with a dress on, and a cat with a dress on, artist, character design, concept art, furry art"
8DF13B3D-3039-02E4-F955-AC0EF97247F5,"a cartoon kiwi sitting on a piece of wood with a thought bubble above it that says i made dis, Cricorps Grégoire, ultra realistic illustration, an illustration of, realism"
6704A193-05A5-4D3B-2347-57812510A69B,"a painting of a dragon in a fantasy land with a fire and water scene in the background and a full moon, Anato Finnstark, dragon art, a storybook illustration, fantasy art"
279AB411-726C-A4D3-4FDE-E92B34AA69FC,"a drawing of a rabbit and a dog in the rain with a red ribbon around it and a black marker, artist, ghibli, a manga drawing, context art"
